ID,Abstract
45,"Most of today's structured data is stored in relationaldatabases. Such a database consists of multiplerelations which are linked together conceptually viaentity-relationship links in the design of relational databaseschemas. Multi-relational classification can be widelyused in many disciplines, such as financial decision making,medical research, and geographical applications.However, most classification approaches only work on single"flat" data relations. It is usually difficult to convertmultiple relations into a single flat relation without eitherintroducing huge, undesirable "universal relation" orlosing essential information. Previous works using InductiveLogic Programming approaches (recently also knownas Relational Mining) have proven effective with high accuracyin multi-relational classification. Unfortunately,they suffer from poor scalability w.r.t. the number of relationsand the number of attributes in databases.In this paper we propose CrossMine, an efficientand scalable approach for multi-relational classification.Several novel methods are developed in CrossMine,including (1) tuple ID propagation, which performssemantics-preserving virtual join to achieve high efficiencyon databases with complex schemas, and (2) a selectivesampling method, which makes it highly scalablew.r.t. the number of tuples in the databases. Both theoreticalbackgrounds and implementation techniques ofCrossMine are introduced. Our comprehensive experimentson both real and synthetic databases demonstratethe high scalability and accuracy of CrossMine."
46,"Most of today's structured data is stored in relational data- bases. Such a database consists of multiple relations that are linked together conceptually via entity-relationship links in the design of relational database schemas. Multi-relational classification can be widely used in many disciplines including financial decision making and medical research. However, most classification approaches only work on single “flat” data relations. It is usually difficult to convert multiple relations into a single flat relation without either introducing huge “universal relation” or losing essential information. Previous works using Inductive Logic Programming approaches (recently also known as Relational Mining) have proven effective with high accuracy in multi-relational classification. Unfortunately, they fail to achieve high scalability w.r.t. the number of relations in databases because they repeatedly join different relations to search for good literals."
47,"Abstract--Web page classification is one of the essential techniques for Web mining because classifying Web pages of an interesting class is often the first step of mining the Web. However, constructing a classifier for an interesting class requires laborious pre-processing such as collecting positive and negative training examples. For instance, in order to construct a homepage classifier, one needs to collect a sample of homepages (positive examples) and a sample of nonhomepages (negative examples). In particular, collecting negative training examples requires arduous work and caution to avoid bias. This paper presents a framework, called Positive Example Based Learning (PEBL), for Web page classification which eliminates the need for manually collecting negative training examples in preprocessing. The PEBL framework applies an algorithm, called Mapping-Convergence (M-C), to achieve high classification accuracy (with positive and unlabeled data) as high as that of a traditional SVM (with positive and negative data). M-C runs in two stages: the mapping stage and convergence stage. In the mapping stage, the algorithm uses a weak classifier that draws an initial approximation of strong negative data. Based on the initial approximation, the convergence stage iteratively runs an internal classifier (e.g., SVM) which maximizes margins to progressively improve the approximation of negative data. Thus, the class boundary eventually converges to the true boundary of the positive class in the feature space. We present the M-C algorithm with supporting theoretical and experimental justifications. Our experiments show that, given the same set of positive examples, the M-C algorithm outperforms one-class SVMs, and it is almost as accurate as the traditional SVMs."
48,"Mining frequent patterns in transaction databases, time-series databases, and many other kinds of databases has been studied popularly in data mining research. Most of the previous studies adopt an Apriori-like candidate set generation-and-test approach. However, candidate set generation is still costly, especially when there exist a large number of patterns and/or long patterns."
49,"Sequential pattern mining has been studied extensivelyin data mining community.Most previous studies requirethe specification of a minimum support threshold to performthe mining.However, it is difficult for users to providean appropriate threshold in practice.To overcomethis difficulty, we propose an alternative task: mining top-kfrequent closed sequential patterns of length no less thanmin_l, where k is the desired number of closed sequentialpatterns to be mined, and min_l is the minimum length ofeach pattern.We mine closed patterns since they are compactrepresentations of frequent patterns.We developed an efficient algorithm, called TSP, whichmakes use of the length constraint and the properties of top-kclosed sequential patterns to perform dynamic support-raisingand projected database-pruning.Our extensive performancestudy shows that TSP outperforms the closed sequentialpattern mining algorithm even when the latter isrunning with the best tuned minimum support threshold."
50,"Association rule mining often generates a huge numberof rules, but a majority of them either are redundantor don not reflect the tue correlation relationship amongdata objects.In this paper, we re-examine this problemand show that two interesting measures, all_confidence(denoted as \alpha) and coherence (denoted as \gamma), both disclosegenuine correlation relationships and can be computedefficiently.Moreover, we propose two interestingalgorithms, CoMine(\alpha) and CoMine(\gamma), based onextensions of a pattern-growth methodology.Our performancestudy shows that the CoMine algorithms havehigh performance in comparison with their Apriori-basedcounterpart algorithms."
51,"Most existing studies of text classification assume that the training data are completely labeled. In reality, however, many information retrieval problems can be more accurately described as learning a binary classifier from a set of incompletely labeled examples, where we typically have a small number of labeled positive examples and a very large number of unlabeled examples. In this paper, we study such a problem of performing Text Classification WithOut labeled Negative data TC-WON). In this paper, we explore an efficient extension of the standard Support Vector Machine (SVM) approach, called SVMC (Support Vector Mapping Convergence) [17]for the TC-WON tasks. Our analyses show that when the positive training data is not too under-sampled, SVMC significantly outperforms other methods because SVMC basically exploits the natural "gap" between positive and negative documents in the feature space, which eventually corresponds to improving the generalization performance. In the text domain there are likely to exist many gaps in the feature space because a document is usually mapped to a sparse and high dimensional feature space. However, as the number of positive training data decreases, the boundary of SVMC starts overfitting at some point and end up generating very poor results.This is because when the positive training data is too few, the boundary over-iterates and trespasses the natural gaps between positive and negative class in the feature space and thus ends up fitting tightly around the few positive training data."
52,"Data cube computation is one of the most essential but expensive operations in data warehousing. Previous studies have developed two major approaches, top-down vs. bottom-up. The former, represented by the Multi-Way Array Cube (called MultiWay) algorithm [25], aggregates simultaneously on multiple dimensions; however, it cannot take advantage of Apriori pruning [2] when computing iceberg cubes (cubes that contain only aggregate cells whose measure value satisfies a threshold, called iceberg condition). The latter, represented by two algorithms: BUC [6] and H-Cubing[11], computes the iceberg cube bottom-up and facilitates Apriori pruning. BUC explores fast sorting and partitioning techniques; whereas H-Cubing explores a data structure, H-Tree, for shared computation. However, none of them fully explores multi-dimensional simultaneous aggregation."
53,"The clustering problem is a difficult problem for the data stream domain. This is because the large volumes of data arriving in a stream renders most traditional algorithms too inefficient. In recent years, a few one-pass clustering algorithms have been developed for the data stream problem. Although such methods address the scalability issues of the clustering problem, they are generally blind to the evolution of the data and do not address the following issues: (1) The quality of the clusters is poor when the data evolves considerably over time. (2) A data stream clustering algorithm requires much greater functionality in discovering and exploring clusters over different portions of the stream."
54,"Object matching is a fundamental problem that arises in numerous information integration scenarios. Virtually all existing solutions assume that the objects to be matched share the same attribute set and that systems can match them by comparing attribute similarities. Our work addresses the more general problem in which objects also have disjoint attributes-for example, matching tuples from relational tables that have different schemas, such as (age, name) and (name, salary). Profile-Based Object Matching, which applies this idea, exploits disjoint attributes to improve matching accuracy. PROM first matches any two tuples based on a shared attribute, such as name. It then applies a set of profilers, each of which contains some knowledge about what constitutes a typical person. The profilers examine the tuple pair to see if it plausibly describes a person. A profiler might state, for example, that if the pair produces a person with an age of 6 and a salary of $100,000, the pair doesn't describe a real person, so the tuples don't match. Profilers can be manually specified by domain experts, trained on training data, transferred from other matching tasks, or built from external data. PROM is thus distinct in that it not only exploits disjoint attributes to improve matching accuracy but also facilitates knowledge reuse from previous object-matching tasks."
55,"Support vector machines (SVMs) have been promising methods for classification and regression analysis because of their solid mathematical foundations which convery several salient properties that other methods hardly provide. However, despite the prominent properties of SVMs, they are not as favored for large-scale data mining as for pattern recognition or machine learning because the training complexity of SVMs is highly dependent on the size of a data set. Many real-world data mining applications involve millions or billions of data records where even multiple scans of the entire data are too expensive to perform. This paper presents a new method, Clustering-Based SVM (CB-SVM), which is specifically designed for handling very large data sets. CB-SVM applies a hierarchical micro-clustering algorithm that scans the entire data set only once to provide an SVM with high quality samples that carry the statistical summaries of the data such that the summaries maximize the benefit of learning the SVM. CB-SVM tries to generate the best SVM boundary for very large data sets given limited amount of resources. Our experiments on synthetic and real data sets show that CB-SVM is highly scalable for very large data sets while also generating high classification accuracy."
56,"Recent research on pattern discovery has progressed form mining frequent itemsets and sequences to mining structured patterns including trees, lattices, and graphs. As a general data structure, graph can model complicated relations among data with wide applications in bioinformatics, Web exploration, and etc. However, mining large graph patterns in challenging due to the presence of an exponential number of frequent subgraphs. Instead of mining all the subgraphs, we propose to mine closed frequent graph patterns. A graph g is closed in a database if there exists no proper supergraph of g that has the same support as g. A closed graph pattern mining algorithm, CloseGraph, is developed by exploring several interesting pruning methods. Our performance study shows that CloseGraph not only dramatically reduces unnecessary subgraphs to be generated but also substantially increases the efficiency of mining, especially in the presence of large graph patterns."
57,"Mining frequent closed itemsets provides complete and non-redundant results for frequent pattern analysis. Extensive studies have proposed various strategies for efficient frequent closed itemset mining, such as depth-first search vs. breadthfirst search, vertical formats vs. horizontal formats, tree-structure vs. other data structures, top-down vs. bottom-up traversal, pseudo projection vs. physical projection of conditional database, etc. It is the right time to ask "what are the pros and cons of the strategies?" and "what and how can we pick and integrate the best strategies to achieve higher performance in general cases?"In this study, we answer the above questions by a systematic study of the search strategies and develop a winning algorithm CLOSET+. CLOSET+ integrates the advantages of the previously proposed effective strategies as well as some ones newly developed here. A thorough performance study on synthetic and real data sets has shown the advantages of the strategies and the improvement of CLOSET+ over existing mining algorithms, including CLOSET, CHARM and OP, in terms of runtime, memory usage and scalability."
58,"Recently, mining data streams with concept drifts for actionable insights has become an important and challenging task for a wide range of applications including credit card fraud protection, target marketing, network intrusion detection, etc. Conventional knowledge discovery tools are facing two challenges, the overwhelming volume of the streaming data, and the concept drifts. In this paper, we propose a general framework for mining concept-drifting data streams using weighted ensemble classifiers. We train an ensemble of classification models, such as C4.5, RIPPER, naive Beyesian, etc., from sequential chunks of the data stream. The classifiers in the ensemble are judiciously weighted based on their expected classification accuracy on the test data under the time-evolving environment. Thus, the ensemble approach improves both the efficiency in learning the model and the accuracy in performing classification. Our empirical study shows that the proposed methods have substantial advantage over single-classifier approaches in prediction accuracy, and the ensemble framework is effective for a variety of classification models."
59,"Nowadays, high throughput experimental techniques make it feasible to examine and collect massive dataat the molecular level.These data, typically mappedto a very high dimensional feature space, carry richinformation about functionalities of certain chemicalor biological entities and can be used to infer valuableknowledge for the purposes of classification and prediction.Typically, a small number of features or featurecombinations may play determinant roles in functionaldiscrimination.The identification of such features orfeature combinations is of great importance.In this paper,we study the problem of discovering compact andhighly discriminative features or feature combinationsfrom a rich feature collection.We employ the supportvector machine as the classification means and aim atfinding compact feature combinations.Comparing toprevious methods on feature selection, which identifyfeatures solely based on their individual roles in theclassification, our method is able to identify minimalfeature combinations that ultimately have determinantroles in a systematic fashion.Experimental study ondrug activity data shows that our method can discoverdescriptors that are not necessarily significant individuallybut are most significant collectively."
60,"The classification of different tumor types is of great importance in cancer diagnosis and drug discovery. However, most previous cancer classification studies are clinical based and have limited diagnostic ability. Cancer classification using gene expression data is known to contain the keys for addressing the fundamental problems relating to cancer diagnosis and drug discovery. The recent advent of DNA microarray technique has made simultaneous monitoring of thousands of gene expressions possible. With this abundance of gene expression data, researchers have started to explore the possibilities of cancer classification using gene expression data. Quite a number of methods have been proposed in recent years with promising results. But there are still a lot of issues which need to be addressed and understood.In order to gain a deep insight into the cancer classification problem, it is necessary to take a closer look at the problem, the proposed solutions and the related issues all together. In this survey paper, we present a comprehensive overview of various proposed cancer classification methods and evaluate them based on their computation time, classification accuracy and ability to reveal biologically meaningful gene information. We also introduce and evaluate various proposed gene selection methods which we believe should be an integral preprocessing step for cancer classification. In order to obtain a full picture of cancer classification, we also discuss several issues related to cancer classification, including the biological significance vs. statistical significance of a cancer classifier, the asymmetrical classification errors for cancer classifiers, and the gene contamination problem."
61,"Interesting patterns often occur at varied levels of support. The classic association mining based on a uniform minimum support, such as Apriori, either misses interesting patterns of low support or suffers from the bottleneck of itemset generation caused by a low minimum support. A better solution lies in exploiting support constraints, which specify what minimum support is required for what itemsets, so that only the necessary itemsets are generated. In this paper, we present a framework of frequent itemset mining in the presence of support constraints. Our approach is to push support constraints into the Apriori itemset generation so that the best minimum support is determined for each itemset at runtime to preserve the essence of Apriori. This strategy is called Adapative Apriori.Experiments show that Adapative Apriori is highly effective in dealing with the bottleneck of itemset generation."
62,"Most of the previous studies on mining association rules are on mining intratransaction associations, i.e., the associations among items within the same transaction where the notion of the transaction could be the items bought by the same customer, the events happened on the same day, etc. In this study, we break the barrier of transactions and extend the scope of mining association rules from traditional single-dimensional, intratransaction associations to multidimensional, intertransaction associations. An intertransaction association describes the association relationships among different transactions. In a database of stock price information, an example of such an association is "if (company) A's stock goes up on day one, B's stock will go down on day two but go up on day four." In this case, no matter whether we treat company or day as the unit of transaction, the associated items belong to different transactions. Moreover, such an intertransaction association can be extended to associate multiple properties in the same rule, so that multidimensional intertransaction associations can also be defined and discovered. Mining intertransaction associations pose more challenges on efficient processing than mining intratransaction associations because the number of potential association rules becomes extremely large after the boundary of transactions is broken. In this study, we introduce the notion of intertransaction association rule, define its measurements: support and confidence, and develop an efficient algorithm, FITI (an acronym for "First Intra Then Inter"), for mining intertransaction associations, which adopts two major ideas: 1) an intertransaction frequent itemset contains only the frequent itemsets of its corresponding intratransaction counterpart; and 2) a special data structure is built among intratransaction frequent itemsets for efficient mining of intertransaction frequent itemsets. We compare FITI with EH-Apriori, the best algorithm in our previous proposal, and demonstrate a substantial performance gain of FITI over EH-Apriori. Further extensions of the method and its implications are also discussed in the paper."
63,"We investigate new approaches for frequent graph-basedpattern mining in graph datasets and propose a novel algorithmcalled gSpan (graph-based Substructure pattern mining),which discovers frequent substructures without candidategeneration. gSpan builds a new lexicographic orderamong graphs, and maps each graph to a unique minimumDFS code as its canonical label. Based on this lexico-graphicorder, gSpan adopts the depth-first search strategyto mine frequent connected subgraphs efficiently. Our performancestudy shows that gSpan substantially outperformsprevious algorithms, sometimes by an order of magnitude."
64,"In this paper, we propose a new mining task: mining top-kfrequent closed patterns of length no less than min_l, wherek is the desired number of frequent closed patterns to bemined, and min _l is the minimal length of each pattern.An efficient algorithm, called TFP, is developed for mining such patterns without minimum support. Two methods, closed_node_count and descendant_sum are proposedto effiectively raise support threshold and prune FP-tree bothduring and after the construction of FP-tree. During themining process, a novel top-down and bottom-up combinedFP-tree mining strategy is developed to speed-up support-raising and closed frequent pattern discovering. In addition,a fast hash-based closed pattern verification scheme has beenemployed to check efficiently if a potential closed pattern isreally closed.Our performance study shows that in most cases, TFPoutperforms CLOSET and CHARM, two efficient frequentclosed pattern mining algorithms, even when both are running with the best tuned min_support. Furthermore, themethod can be extended to generate association rules andto incorporate user-specified constraints. Thus we concludethat for frequent pattern mining, mining top-k frequent closedpatterns without min support is more preferable than thetraditional min_support-based mining."
65,"Frequent pattern mining has been studied extensively.However, the effectiveness and efficiency of this mining isoften limited, since the number of frequent patterns generatedis often too large. In many applications it is sufficientto generate and examine only frequent patterns with supportfrequency in close-enough approximation instead of in fullprecision. Such a compact but close-enough frequent patternbase is called a condensed frequent patterns-base.In this paper, we propose and examine several alternativesat the design, representation, and implementation ofsuch condensed frequent pattern-bases. A few algorithmsfor computing such pattern-bases are proposed. Their effectivenessat pattern compression and their efficient computationmethods are investigated. A systematic performancestudy is conducted on different kinds of databases,which demonstrates the effectiveness and efficiency of ourapproach at handling frequent pattern mining in largedatabases."
66,"Constraints are essential for many sequential pattern mining applications. However, there is no systematic study on constraint-based sequential pattern mining. In this paper, we investigate this issue and point out that the framework developed for constrained frequent-pattern mining does not fit our missions well. An extended framework is developed based on a sequential pattern growth methodology. Our study shows that constraints can be effectively and efficiently pushed deep into sequential pattern mining under this new framework. Moreover, this framework can be extended to constraint-based structured pattern mining as well."
