ID,Abstract
67,"Searching, comprehending, and using the semistructured HTML, XML, and database-service-engineinformation stored on the Web poses a significant challenge: This data is more sophisticated and dynamic than the information commercial database systems store. To supplement keywordbased indexing, researchers have applied data mining to Webpage ranking. In this context, data mining helps Web search engines find high-quality Web pages and enhances Web click stream analysis. For the Web to reach its full potential, however, we must improve its services, make it more comprehensible, and increase its usability. As researchers continue to develop data mining techniques, the authors believe this technology will play an increasingly important role in meeting the challenges of developing the intelligent Web.Ultimately, data mining for Web intelligence will make the Web a richer, friendlier, and more intelligent resource that we can all share and explore."
68,"Multidimensional inter-transactional association rules extend the traditional association rules to describe more general associations among items with multiple properties across transactions. “After McDonald and Burger King open branches, KFC will open a branch two months later and one mile away” is an example of such rules. Since the number of potential inter-transactional association rules tends to be extremely large, mining inter-transactional associations poses more challenges on efficient processing than mining traditional intra-transactional associations. In order to make such association rule mining truly practical and computationally tractable, in this study we present a template model to help users declare the interesting multidimensional inter-transactional associations to be mined. With the guidance of templates, several optimization techniques, i.e., joining, converging, and speeding, are devised to speed up the discovery of inter-transactional association rules. We show, through a series of experiments on both synthetic and real-life data sets, that these optimization techniques can yield significant performance benefits."
69,"Spatial data mining is the discovery of interesting relationships and characteristics that may exist implicitly in spatial databases. To this end, this paper has three main contributions. First, we propose a new clustering method called CLARANS, whose aim is to identify spatial structures that may be present in the data. Experimental results indicate that, when compared with existing clustering methods, CLARANS is very efficient and effective. Second, we investigate how CLARANS can handle not only points objects, but also polygon objects efficiently. One of the methods considered, called the IR-approximation, is very efficient in clustering convex and nonconvex polygon objects. Third, building on top of CLARANS, we develop two spatial data mining algorithms that aim to discover relationships between spatial and nonspatial attributes. Both algorithms can discover knowledge that is difficult to find with existing spatial data mining algorithms."
70,"Partitioning a data cube into sets of cells with "similar behavior" often better exposes the semantics in the cube. E.g., if we find that average boots sales in the West 10th store of Walmart was the same for winter as for the whole year, it signifies something interesting about the trend of boots sales in that location in that year. In this paper, we are interested in finding succinct summaries of the data cube, exploiting regularities present in the cube, with a clear basis. We would like the summary: (i) to be as concise as possible, (ii) to itself form a lattice preserving the rollup/drilldown semantics of the cube, and (iii) to allow the original cube to be fully recovered. We illustrate the utility of solving this problem and discuss the inherent challenges. We develop techniques for partitioning cube cells for obtaining succinct summaries, and introduce the quotient cube. We give efficient algorithms for computing it from a base table. For monotone aggregate functions (e.g., COUNT, MIN, MAX, SUM on non-negative measures, etc.), our solution is optimal (i.e., quotient cube of the least size). For nonmonotone functions (e.g., AVG), we obtain a locally optimal solution. We experimentally demonstrate the efficacy of our ideas and techniques and the scalability of our algorithms."
71,"Real-time production systems and other dynamic environments often generate tremendous (potentially infinite) amount of stream data; the volume of data is too huge to be stored on disks or scanned multiple times. Can we perform on-line, multi-dimensional analysis and data mining of such data to alert people about dramatic changes of situations and to initiate timely, high-quality responses? This is a challenging task."
72,"Automated, scalable systems would reveal and help exploit the deeper meanings in scientific data, especially in biomedical engineering, telecommunications, geospatial exploration, and climate and Earth ecosystem modeling."
73,"Recent progress in data mining research has led to the development of numerous efficient and scalable methods for mining interesting patterns in large databases. In the mean time, recent progress in biology, medical science, and DNA technology has led to the accumulation of tremendous amounts of bio-medical data that demands for in-depth analysis. The question becomes how to bridge the two fields, data mining and bioinformatics, for successful mining of bio-medical data. In this abstract, we analyze how data mining may help bio-medical data analysis and outline some research problems that may motivate the further developments of data mining tools for bio-data analysis."
74,"Web page classification is one of the essential techniques for Web mining. Specifically, classifying Web pages of a user-interesting class is the first step of mining interesting information from the Web. However, constructing a classifier for an interesting class requires laborious pre-processing such as collecting positive and negative training examples. For instance, in order to construct a "homepage" classifier, one needs to collect a sample of homepages (positive examples) and a sample of non-homepages (negative examples). In particular, collecting negative training examples requires arduous work and special caution to avoid biasing them. We introduce in this paper the Positive Example Based Learning (PEBL) framework for Web page classification which eliminates the need for manually collecting negative training examples in pre-processing. We present an algorithm called Mapping-Convergence (M-C) that achieves classification accuracy (with positive and unlabeled data) as high as that of traditional SVM (with positive and negative data). Our experiments show that when the M-C algorithm uses the same amount of positive examples as that of traditional SVM, the M-C algorithm performs as well as traditional SVM."
75,"In this paper, we present a novel algorithm Opportune Project for mining complete set of frequent item sets by projecting databases to grow a frequent item set tree. Our algorithm is fundamentally different from those proposed in the past in that it opportunistically chooses between two different structures, array-based or tree-based, to represent projected transaction subsets, and heuristically decides to build unfiltered pseudo projection or to make a filtered copy according to features of the subsets. More importantly, we propose novel methods to build tree-based pseudo projections and array-based unfiltered projections for projected transaction subsets, which makes our algorithm both CPU time efficient and memory saving. Basically, the algorithm grows the frequent item set tree by depth first search, whereas breadth first search is used to build the upper portion of the tree if necessary. We test our algorithm versus several other algorithms on real world datasets, such as BMS-POS, and on IBM artificial datasets. The empirical results show that our algorithm is not only the most efficient on both sparse and dense databases at all levels of support threshold, but also highly scalable to very large databases."
76,"Data cube enables fast online analysis of large data repositories which is attractive in many applications. Although there are several kinds of available cube-based OLAP products, users may still encounter challenges on effectiveness and efficiency in the exploration of large data cubes due to the huge computation space as well as the huge observation space in a data cube. CubeExplorer is an integrated environment for online exploration of data cubes. It integrates our newly developed techniques on iceberg cube computation [2], cube-based feature extraction, and gradient analysis [1], and makes cube exploration effective and efficient. In this demo, we will show the features of CubeExplorer, especially its power and flexibility at exploring and mining of large databases."
77,"Pattern discovery in long sequences is of great importance in many applications including computational biology study, consumer behavior analysis, system performance analysis, etc. In a noisy environment, an observed sequence may not accurately reflect the underlying behavior. For example, in a protein sequence, the amino acid N is likely to mutate to D with little impact to the biological function of the protein. It would be desirable if the occurrence of D in the observation can be related to a possible mutation from N in an appropriate manner. Unfortunately, the support measure (i.e., the number of occurrences) of a pattern does not serve this purpose. In this paper, we introduce the concept of compatibility matrix as the means to provide a probabilistic connection from the observation to the underlying true value. A new metric match is also proposed to capture the "real support" of a pattern which would be expected if a noise-free environment is assumed. In addition, in the context we address, a pattern could be very long. The standard pruning technique developed for the market basket problem may not work efficiently. As a result, a novel algorithm that combines statistical sampling and a new technique (namely border collapsing) is devised to discover long patterns in a minimal number of scans of the sequence database with sufficiently high confidence. Empirical results demonstrate the robustness of the match model (with respect to the noise) and the efficiency of the probabilistic algorithm."
78,"It has been well recognized that frequent pattern mining plays an essential role in many important data mining tasks. However, frequent pattern mining often generates a very large number of patterns and rules, which reduces not only the efficiency but also the effectiveness of mining. Recent work has highlighted the importance of the constraint-based mining paradigm in the context of mining frequent itemsets, associations, correlations, sequential patterns, and many other interesting patterns in large databases.Recently, we developed efficient pattern-growth methods for frequent pattern mining. Interestingly, pattern-growth methods are not only efficient but also effective in mining with various constraints. Many tough constraints which cannot be handled by previous methods can be pushed deep into the pattern-growth mining process. In this paper, we overview the principles of pattern-growth methods for constrained frequent pattern mining and sequential pattern mining. Moreover, we explore the power of pattern-growth methods towards mining with tough constraints and highlight some interesting open problems."
79,"In this paper, we propose an efficient algorithm, called TD-FP-Growth (the shorthand for Top-Down FP-Growth), to mine frequent patterns. TD-FP-Growth searches the FP-tree in the top-down order, as opposed to the bottom-up order of previously proposed FP-Growth. The advantage of the topdown search is not generating conditional pattern bases and sub-FP-trees, thus, saving substantial amount of time and space. We extend TD-FP-Growth to mine association rules by applying two new pruning strategies: one is to push multiple minimum supports and the other is to push the minimum confidence. Experiments show that these algorithms and strategies are highly effective in reducing the search space."
80,"A major obstacle in data mining applications is the gap between the statistic-based pattern extraction and the value-based decision making. We present a profit mining approach to reduce this gap. In profit mining, we are given a set of past transactions and pre-selected target items, and we like to build a model for recommending target items and promotion strategies to new customers, with the goal of maximizing the net profit. We identify several issues in profit mining and propose solutions. We evaluate the effectiveness of this approach using data sets of a wide range of characteristics."
81,"DBMiner is an online analytical mining system, developed for interactive mining of multiple-level knowledge in large relational databases and data warehouses (see Chapters 6.1 and 13). The distinct feature of the system is its tight integration of online analytical processing (OLAP) with a wide spectrum of data mining functions, including characterization, association, classification, prediction, and clustering (see Chapters 16.1, 16.2.2, 16.2.3 and 16.5). The system facilitates query-based, interactive mining of multidimensional databases (see Chapter 6.3) by implementing a set of advanced data mining techniques, including OLAP-based induction, multidimensional statistical analysis, progressive deepening for mining refined knowledge, meta-rule guided mining, and data and knowledge visualization (see Chapter 20). DBMiner integrates smoothly with commercial relational database and data warehouse systems, and provides a user-friendly, interactive data mining environment with high performance. With extensions to the DBMiner system, several specialized data mining system prototypes, including GeoMiner, MultiMediaMiner, and WeblogMiner, have been designed and developed for mining complex types of data with interesting applications."
82,"Descriptive data mining is the description of a set of data in a concise and summary manner and the presentation of the general properties of the data. Mining characteristic rules and discriminant rules from the data are two essential components in descriptive data mining. In contrast to online analytical processing, data description puts more emphasis on (1) automated processing, helping users determine which dimensions (or attributes) should be included in the analysis and to what abstraction level the data set should be generalized in order to obtain interesting summarization; and (2) handling complex data types. Mining data characteristics and discriminant descriptions can be implemented based on a data cube method or an attribute-oriented induction method. Moreover, data description can be enhanced by data dispersion analysis, multifeature data cubes, and discovery-driven data cubes."
83,"Methods for efficient mining of frequent patterns have been studied extensively by many researchers. However, the previously proposed methods still encounter someperformance bottlenecks when mining databases with different data characteristics, such as dense vs. sparse, long vs. short patterns, memory-based vs. disk-based, etc.In this study, we propose a simple and novel hyper-linkeddata structure, H-struct , and a new mining algorithm, H-mine ,which takes advantage of this data structure anddynamically adjusts links in the mining process. A distinct feature of this method is that it has very limitedand precisely predictable space overhead and runs really fast in memory-based setting. Moreover, it ca be scaled up to very large databases by database partitioning, and whenthe data set becomes dense,(conditional)FP-trees can be constructed dynamically as part of the mining process. Our study shows that H-mine has high performance in various kinds of data, outperforms the previously developedalgorithms in different settings, and is highly scalable in mining large databases. This study also proposes a new datamining methodology, space-preserving mining ,which mayhave strong impact in the future development of efficient and scalable data mining methods."
84,"Previous studies propose that associative classification has high classification accuracy and strong flexibility at handling unstructured data. However, it still suffers from the huge set of mined rules and sometimes biased classification or overfitting since the classificationis based on only single high-confidence rule. In this study, we propose new associative classification method, CMAR, i.e., Classification based on Multiple Association Rules. The method extends an efficient frequent pattern mining method, FP-growth ,constructs classdistribution-associated FP-tree, and mines large database efficiently. Moreover, it applies CR-tree structure to store and retrieve mined association rulesefficiently, and prunes rules effectively based on confidence, correlation and database coverage. The classification is performed based on weighted X2 analysis using multiple strong association rules. Our extensive experiments on 26 databases from UCI machine learning database repository show that CMAR is consistent, highly effective at classificationof various kinds of databases and has better average classificationaccuracy in comparison with CBA and C4.5.Moreover,our performancestudy shows that the method is highly efficient and scalable in comparison with other reported associative classification methods."
85,"Sequential pattern mining, which finds the set of frequent subsequences in sequence databases, is an important data-mining task and has broad applications. Usually, sequence patterns are associated with different circumstances, and such circumstances form a multiple dimensional space. For example, customer purchase sequences are associated with region, time, customer group, and others. It is interesting and useful to mine sequential patterns associated with multi-dimensional information.In this paper, we propose the theme of multi-dimensional sequential pattern mining, which integrates the multidimensional analysis and sequential data mining. We also thoroughly explore efficient methods for multi-dimensional sequential pattern mining. We examine feasible combinations of efficient sequential pattern mining and multi-dimensional analysis methods, as well as develop uniform methods for high-performance mining. Extensive experiments show the advantages as well as limitations of these methods. Some recommendations on selecting proper method with respect to data set properties are drawn."
86,"Many people rely on the recommendations of trusted friends to find restaurants or movies, which match their tastes. But, what if your friends have not sampled the item of interest? Collaborative filtering (CF) seeks to increase the effectiveness of this process by automating the derivation of a recommendation, often from a clique of advisors that we have no prior personal relationship with. CF is a promising tool for dealing with the information overload that we face in the networked world."
87,"Outlier detection is an important task in data mining with numerous applications, including credit card fraud detection, video surveillance, etc. A recent work on outlier detection has introduced a novel notion of local outlier in which the degree to which an object is outlying is dependent on the density of its local neighborhood, and each object can be assigned a Local Outlier Factor (LOF) which represents the likelihood of that object being an outlier. Although the concept of local outliers is a useful one, the computation of LOF values for every data objects requires a large number of κ-nearest neighbors searches and can be computationally expensive. Since most objects are usually not outliers, it is useful to provide users with the option of finding only n most outstanding local outliers, i.e., the top-n data objects which are most likely to be local outliers according to their LOFs. However, if the pruning is not done carefully, finding top-n outliers could result in the same amount of computation as finding LOF for all objects. In this paper, we propose a novel method to efficiently find the top-n local outliers in large databases. The concept of "micro-cluster" is introduced to compress the data. An efficient micro-cluster-based local outlier mining algorithm is designed based on this concept. As our algorithm can be adversely affected by the overlapping in the micro-clusters, we proposed a meaningful cut-plane solution for overlapping data. The formal analysis and experiments show that this method can achieve good performance in finding the most outstanding local outliers."
88,"It is often too expensive to compute and materialize a complete high-dimensional data cube. Computing an iceberg cube, which contains only aggregates above certain thresholds, is an effective way to derive nontrivial multi-dimensional aggregations for OLAP and data mining."
89,"Constrained clustering--finding clusters that satisfy user-specified constraints--is highly desirable in many applications. In this paper, we introduce the constrained clustering problem and show that traditional clustering algorithms (e.g., k-means) cannot handle it. A scalable constraint-clustering algorithm is developed in this study which starts by finding an initial solution that satisfies user-specified constraints and then refines the solution by performing confined object movements under constraints. Our algorithm consists of two phases: pivot movement and deadlock resolution. For both phases, we show that finding the optimal solution is NP-hard. We then propose several heuristics and show how our algorithm can scale up for large data sets using the heuristic of micro-cluster sharing. By experiments, we show the effectiveness and efficiency of the heuristics."
90,"With a huge amount of data stored in spatial databases and the introduction of spatial components to many relational or object-relational databases, it is important to study the methods for spatial data warehousing and OLAP of spatial data. In this paper, we study methods for spatial OLAP, by integration of nonspatial OLAP methods with spatial database implementation techniques. A spatial data warehouse model, which consists of both spatial and nonspatial dimensions and measures, is proposed. Methods for computation of spatial data cubes and analytical processing on such spatial data cubes are studied, with several strategies proposed, including approximation and selective materialization of the spatial objects resulted from spatial OLAP operations. The focus of our study is on a method for spatial cube construction, called object-based selective materialization, which is different from cuboid-based selective materialization proposed in previous studies of nonspatial data cube construction. Rather than using a cuboid as an atomic structure during the selective materialization, we explore granularity on a much finer level, that of a single cell of a cuboid. Several algorithms are proposed for object-based selective materialization of spatial data cubes and the performance study has demonstrated the effectiveness of these techniques."
91,"In this paper, we extend the scope of mining association rules from traditional single-dimensional intratransaction associations, to multidimensional intertransaction associations. Intratransaction associations are the associations among items with the same transaction, where the notion of the transaction could be the items bought by the same customer, the events happened on the same day, and so on. However, an intertransaction association describes the association relationships among different transactions, such as “if(company) A's stock goes up on day 1, B's stock will go down on day 2, but go up on day 4.” In this case, whether we treat company or day as the unit of transaction, the associated items belong to different transactions. Moreover, such an intertransaction association can be extended to associate multiple contextual properties in the same rule, so that multidimensional intertransaction associations can be defined and discovered. A two-dimensional intertransaction association rule example is “After McDonald and Burger King open branches, KFC will open a branch two months later and one mile away,” which involves two dimensions: time and space. Mining intertransaction associations poses more challenges on efficient processing than mining intratransaction associations. Interestingly, intratransaction association can be treated as a special case of intertransaction association from both a conceptual and algorithmic point of view. In this study, we introduce the notion of multidimensional intertransaction association rules, study their measurements—support and confidence—and develop algorithms for mining intertransaction associations by extension of Apriori. We overview our experience using the algorithms on both real-life and synthetic data sets. Further extensions of multidimensional intertransaction association rules and potential applications are also discussed."
