ID,Abstract
23,"Frequent itemset mining has been studied extensively in literature. Most previous studies require the specification of a min_support threshold and aim at mining a complete set of frequent itemsets satisfying min_support. However, in practice, it is difficult for users to provide an appropriate min_support threshold. In addition, a complete set of frequent itemsets is much less compact than a set of frequent closed itemsets. In this paper, we propose an alternative mining task: mining top-k frequent closed itemsets of length no less than min_l, where k is the desired number of frequent closed itemsets to be mined, and min_l is the minimal length of each itemset. An efficient algorithm, called TFP, is developed for mining such itemsets without mins_support. Starting at min_support = 0 and by making use of the length constraint and the properties of top-k frequent closed itemsets, min_support can be raised effectively and FP-Tree can be pruned dynamically both during and after the construction of the tree using our two proposed methods: the closed node count and descendant_sum. Moreover, mining is further speeded up by employing a top-down and bottom-up combined FP-Tree traversing strategy, a set of search space pruning methods, a fast 2-level hash-indexed result tree, and a novel closed itemset verification scheme. Our extensive performance study shows that TFP has high performance and linear scalability in terms of the database size."
24,"Previous work on mining transactional database has focused primarily on mining frequent itemsets, association rules, and sequential patterns. However, interesting relationships between customers and items, especially their evolution with time, have not been studied thoroughly. In this paper, we propose a Gaussian transformation-based regression model that captures time-variant relationships between customers and products. Moreover, since it is interesting to discover such relationships in a multi-dimensional space, an efficient method has been developed to compute multi-dimensional aggregates of such curves in a data cube environment. Our experimental results have demonstrated the promise of the approach."
25,"The iceberg cube mining computes all cells v, corresponding to GROUP BY partitions, that satisfy a given constraint on aggregated behaviors of the tuples in a GROUP BY partition. The number of cells often is so large that the result cannot be realistically searched without pushing the constraint into the search. Previous works have pushed antimonotone and monotone constraints. However, many useful constraints are neither antimonotone nor monotone. We consider a general class of aggregate constraints of the form f(v)\theta \sigma, where f is an arithmetic function of SQL-like aggregates and \theta is one of <,\leq,\geq,>. We propose a novel pushing technique, called Divide-and-Approximate, to push such constraints. The idea is to recursively divide the search space and approximate the given constraint using antimonotone or monotone constraints in subspaces. This technique applies to a class called separable constraints, which properly contains all constraints built by an arithmetic function f of all SQL aggregates."
26,"  Motivation:  The rapid accumulation of biological network data translates into an urgent need for computational methods for graph pattern mining. One important problem is to identify recurrent patterns across multiple networks to discover biological modules. However, existing algorithms for frequent pattern mining become very costly in time and space as the pattern sizes and network numbers increase. Currently, no efficient algorithm is available for mining recurrent patterns across large collections of genome-wide networks."
27,"A topic directory, e.g., Yahoo directory, provides a view of a document set at different levelsof abstraction and is ideal for the interactive exploration and visualization of the document set. We present a method that dynamically generates a topic directory from a document set usinga frequent closed termset mining algorithm. Our method shows experimental results of equal quality to recent document clustering methods and has additional benefits such as automatic generation of topic labels and determination of a clustering parameter."
28,"Sequential pattern mining is an important data mining problem with broad applications. However, it is also a difficult problem since the mining may have to generate or examine a combinatorially explosive number of intermediate subsequences. Most of the previously developed sequential pattern mining methods, such as GSP, explore a candidate generation-and-test approach [1] to reduce the number of candidates to be examined. However, this approach may not be efficient in mining large sequence databases having numerous patterns and/or long patterns. In this paper, we propose a projection-based, sequential pattern-growth approach for efficient mining of sequential patterns. In this approach, a sequence database is recursively projected into a set of smaller projected databases, and sequential patterns are grown in each projected database by exploring only locally frequent fragments. Based on an initial study of the pattern growth-based sequential pattern mining, FreeSpan [8], we propose a more efficient method, called PSP, which offers ordered growth and reduced projected databases. To further improve the performance, a pseudoprojection technique is developed in PrefixSpan. A comprehensive performance study shows that PrefixSpan, in most cases, outperforms the a priori-based algorithm GSP, FreeSpan, and SPADE [29] (a sequential pattern mining algorithm that adopts vertical data format), and PrefixSpan integrated with pseudoprojection is the fastest among all the tested algorithms. Furthermore, this mining methodology can be extended to mining sequential patterns with user-specified constraints. The high promise of the pattern-growth approach may lead to its further extension toward efficient mining of other kinds of frequent patterns, such as frequent substructures."
29,"People recently are interested in a new operator, called skyline [3], which returns the objects that are not dominated by any other objects with regard to certain measures in a multi-dimensional space. Recent work on the skyline operator [3,15,8,13,2] focuses on efficient computation of skylines in large databases. However, such work gives users only thin skylines, i.e., single objects, which may not be desirable in some real applications. In this paper, we propose a novel concept, called thick skyline, which recommends not only skyline objects but also their nearby neighbors within -distance. Efficient computation methods are developed including (1) two efficient algorithms, Sampling-and-Pruning and Indexing-and-Estimating, to find such thick skyline with the help of statistics or indexes in large databases, and (2) a highly efficient Microcluster-based algorithm for mining thick skyline. The Microcluster-based method not only leads to substantial savings in computation but also provides a cocise representation of the thick skyline in the case of high cardinalities. Our experimental performance study shows that the proposed methods are both efficient and effective."
30,"Frequent-pattern mining has been studied extensively and has many useful applications. However, frequent-pattern mining often generates too many patterns to be truly efficient or effective. In many applications, it is sufficient to generate and examine frequent patterns with a sufficiently good approximation of the support frequency instead of in full precision. Such a compact but "close-enough" frequent-pattern base is called a condensed frequent-pattern base.In this paper, we propose and examine several alternatives for the design, representation, and implementation of such condensed frequent-pattern bases. Several algorithms for computing such pattern bases are proposed. Their effectiveness at pattern compression and methods for efficiently computing them are investigated. A systematic performance study is conducted on different kinds of databases, and demonstrates the effectiveness and efficiency of our approach in handling frequent-pattern mining in large databases."
31,"The data stream problem has been studied extensively in recent years, because of the great ease in collection of stream data. The nature of stream data makes it essential to use algorithms which require only one pass over the data. Recently, single-scan, stream analysis methods have been proposed in this context. However, a lot of stream data is high-dimensional in nature. High-dimensional data is inherently more complex in clustering, classification, and similarity search. Recent research discusses methods for projected clustering over high-dimensional data sets. This method is however difficult to generalize to data streams because of the complexity of the method and the large volume of the data streams."
32,"Data cube has been playing an essential role in fast OLAP (online analytical processing) in many multi-dimensional data warehouses. However, there exist data sets in applications like bioinformatics, statistics, and text processing that are characterized by high dimensionality, e.g., over 100 dimensions, and moderate size, e.g., around 106 tuples. No feasible data cube can be constructed with such data sets. In this paper we will address the problem of developing an efficient algorithm to perform OLAP on such data sets."
33,"Many real-world graphs have been shown to be scale-free---vertex degrees follow power law distributions, vertices tend to cluster, and the average length of all shortest paths is small. We present a new model for understanding scale-free networks based on multilevel geodesic approximation, using a new data structure called a multilevel mesh.Using this multilevel framework, we propose a new kind of graph clustering for data reduction of very large graph systems such as social, biological, or electronic networks. Finally, we apply our algorithms to real-world social networks and protein interaction graphs to show that they can reveal knowledge embedded in underlying graph structures. We also demonstrate how our data structures can be used to quickly answer approximate distance and shortest path queries on scale-free networks."
34,"Due to the advances in positioning technologies, the real time information of moving objects becomes increasingly available, which has posed new challenges to the database research. As a long-standing technique to identify overall distribution patterns in data, clustering has achieved brilliant successes in analyzing static datasets. In this paper, we study the problem of clustering moving objects, which could catch interesting pattern changes during the motion process and provide better insight into the essence of the mobile data points. In order to catch the spatial-temporal regularities of moving objects and handle large amounts of data, micro-clustering [20] is employed. Efficient techniques are proposed to keep the moving micro-clusters geographically small. Important events such as the collisions among moving micro-clusters are also identified. In this way, high quality moving micro-clusters are dynamically maintained, which leads to fast and competitive clustering result at any given time instance. We validate our approaches with a through experimental evaluation, where orders of magnitude improvement on running time is observed over normal K-Means clustering method [14]."
35,"Many real life sequence databases grow incrementally. It is undesirable to mine sequential patterns from scratch each time when a small set of sequences grow, or when some new sequences are added into the database. Incremental algorithm should be developed for sequential pattern mining so that mining can be adapted to incremental database updates. However, it is nontrivial to mine sequential patterns incrementally, especially when the existing sequences grow incrementally because such growth may lead to the generation of many new patterns due to the interactions of the growing subsequences with the original ones. In this study, we develop an efficient algorithm, IncSpan, for incremental mining of sequential patterns, by exploring some interesting properties. Our performance study shows that IncSpan outperforms some previously proposed incremental algorithms as well as a non-incremental one with a wide margin."
36,"Current models of the classification problem do not effectively handle bursts of particular classes coming in at different times. In fact, the current model of the classification problem simply concentrates on methods for one-pass classification modeling of very large data sets. Our model for data stream classification views the data stream classification problem from the point of view of a dynamic approach in which simultaneous training and testing streams are used for dynamic classification of data sets. This model reflects real life situations effectively, since it is desirable to classify test streams in real time over an evolving training and test stream. The aim here is to create a classification system in which the training model can adapt quickly to the changes of the underlying data stream. In order to achieve this goal, we propose an on-demand classification process which can dynamically select the appropriate window of past training data to build the classifier. The empirical results indicate that the system maintains a high classification accuracy in an evolving data stream, while providing an efficient solution to the classification task."
37,"To enable information integration, schema matching is a critical step for discovering semantic correspondences of attributes across heterogeneous sources. While complex matchings are common, because of their far more complex search space, most existing techniques focus on simple 1:1 matchings. To tackle this challenge, this paper takes a conceptually novel approach by viewing schema matching as correlation mining, for our task of matching Web query interfaces to integrate the myriad databases on the Internet. On this "deep Web," query interfaces generally form complex matchings between attribute groups (e.g., [author] corresponds to [first name, last name] in the Books domain). We observe that the co-occurrences patterns across query interfaces often reveal such complex semantic relationships: grouping attributes (e.g., [first name, last name]) tend to be co-present in query interfaces and thus positively correlated. In contrast, synonym attributes are negatively correlated because they rarely co-occur. This insight enables us to discover complex matchings by a correlation mining approach. In particular, we develop the DCM framework, which consists of data preparation, dual mining of positive and negative correlations, and finally matching selection. Unlike previous correlation mining algorithms, which mainly focus on finding strong positive correlations, our algorithm cares both positive and negative correlations, especially the subtlety of negative correlations, due to its special importance in schema matching. This leads to the introduction of a new correlation measure, $H$-measure, distinct from those proposed in previous work. We evaluate our approach extensively and the results show good accuracy for discovering complex matchings."
38,"Many data analysis tasks can be viewed as search or mining in a multidimensional space (MDS). In such MDSs, dimensions capture potentially important factors for given applications, and cells represent combinations of values for the factors. To systematically analyze data in MDS, an interesting notion, called "cubegrade was recently introduced by Imielinski et al. [CHECK END OF SENTENCE], which focuses on the notable changes in measures in MDS by comparing a cell (which we refer to as probe cell) with its gradient cells, namely, its ancestors, descendants, and siblings. We call such queries gradient analysis queries (GQs). Since an MDS can contain billions of cells, it is important to answer GQs efficiently. In this study, we focus on developing efficient methods for mining GQs constrained by certain (weakly) antimonotone constraints. Instead of conducting an independent gradient-cell search once per probe cell, which is inefficient due to much repeated work, we propose an efficient algorithm, LiveSet-Driven. This algorithm finds all good gradient-probe cell pairs in one search pass. It utilizes measure-value analysis and dimension-match analysis in a set-oriented manner, to achieve bidirectional pruning between the sets of hopeful probe cells and of hopeful gradient cells. Moreover, it adopts a hypertree structure and an H-cubing method to compress data and to maximize sharing of computation. Our performance study shows that this algorithm is efficient and scalable. In addition to data cubes, we extend our study to another important scenario: mining constrained gradients in transactional databases where each item is associated with some measures such as price. Such transactional databases can be viewed as sparse MDSs where items represent dimensions, although they have significantly different characteristics than data cubes. We outline efficient mining methods for this problem in this paper."
39,"The data cube and iceberg cube computation problemhas been studied by many researchers. There are three majorapproaches developed in this direction: (1) top-downcomputation, represented by MultiWay array aggregation[An Array-Based Algorithm for Simultaneous Multidimensional Aggregates], which utilizes shared computation and performs wellon dense data sets; (2) bottom-up computation, representedby BUC [Bottom-up computation of sparse and iceberg cubes], which takes advantage of Apriori Pruning and performs well on sparse data sets; and (3) integratedtop-down and bottom-up computation, represented by Star-Cubing[Computing Iceberg Cubes by Top-Down and Bottom-Up Integration], which takes advantages of both and has high performance in most cases. However, the performance ofStar-Cubing degrades in very sparse data sets due to theadditional cost introduced by the tree structure. None of thethree approaches achieves uniformly high performance onall kinds of data sets.In this paper, we present a new approach that computeIceberg Cubes by factorizing the lattice space accordingto the frequency of values. This approach, different fromall the previous dimension-based approaches where the importanceof data distribution is not recognized, partitionsthe cube lattice into one dense subspace and several sparsesubspaces. With this approach, a new method called MM-Cubinghas been developed. MM-Cubing is highly adaptiveto dense, sparse or skewed data sets. Our performancestudy shows that MM-Cubing is efficient and achieves highperformance over all kinds of data distributions."
40,"The paper describes a new method of continuously monitoringthe k nearest neighbors of a given object in the mobileenvironment.Instead of monitoring all k nearest neighbors,we choose to monitor the k-th (nearest) neighbor sincethe necessary condition of changes in the KNN is the changeof the k-th neighbor.In addition, rather than in the originalspace, we consider the moving objects in a transformedtime-distance (TD) space, where each object is representedby a curve.A beach-line algorithm is developed to monitorthe change of the k-th neighbor, which enables us to maintainthe KNN incrementally.An extensive empirical studyshows that the beach-line algorithm outperforms the mostefficient existing algorithm by a wide margin, especiallywhen k or n (the total number of objects) is large."
41,"To enable information integration, schema matching is a critical step for discovering semantic correspondences of attributes across heterogeneous sourcess. As a new attempt, this paper studies such matching as a data mining problem. Specifically, while complex matchings are common, because of their far more complex search space, most existing techniques focus on simple 1:1 matchings. To tackle this challenge, this paper takes a conceptually novel approach by viewing schema matching as correlation mining, for our task of matching Web query interfaces to integrate the myriad databases on the Internet. On this "deep Web," query interfaces generally form complex matchings between attribute groups (e.g., {author} corresponds to {first name, last name} in the Books domain). We observe that the co-occurrences patterns across query interfaces often reveal such complex semantic relationships: grouping attributes (e.g., {first name, last name}) tend to be co-present in query interfaces and thus positively correlated. In contrast, synonym attributes are negatively correlated because they rarely co-occur. This insight enables us to discover complex matchings by a correlation mining approach, which consists of dual mining of positive and negative correlations. We evaluate our approach on deep Web sources in several object domains (e.g., Books and Airfares) and the results show that the correlation mining approach does discover semantically meaningful matchings among attributes."
42,"Graph has become increasingly important in modelling complicated structures and schemaless data such as proteins, chemical compounds, and XML documents. Given a graph query, it is desirable to retrieve graphs quickly from a large database via graph-based indices. In this paper, we investigate the issues of indexing graphs and propose a novel solution by applying a graph mining technique. Different from the existing path-based methods, our approach, called gIndex, makes use of frequent substructure as the basic indexing feature. Frequent substructures are ideal candidates since they explore the intrinsic characteristics of the data and are relatively stable to database updates. To reduce the size of index structure, two techniques, size-increasing support constraint and discriminative fragments, are introduced. Our performance study shows that gIndex has 10 times smaller index size, but achieves 3--10 times better performance in comparison with a typical path-based method, GraphGrep. The gIndex approach not only provides and elegant solution to the graph indexing problem, but also demonstrates how database indexing and query processing can benefit form data mining, especially frequent pattern mining. Furthermore, the concepts developed here can be applied to indexing sequences, trees, and other complicated structures as well."
43,"Recent work has highlighted the importance of the constraint-based mining paradigm in the context of frequent itemsets, associations, correlations, sequential patterns, and many other interesting patterns in large databases. Constraint pushing techniques have been developed for mining frequent patterns and associations with antimonotonic, monotonic, and succinct constraints. In this paper, we study constraints which cannot be handled with existing theory and techniques in frequent pattern mining. For example, avg(S)θv, median(S)θv, sum(S)θv (S can contain items of arbitrary values, θ ∈ {>, <, ≤, ≥} and v is a real number.) are customarily regarded as “tough” constraints in that they cannot be pushed inside an algorithm such as Apriori. We develop a notion of convertible constraints and systematically analyze, classify, and characterize this class. We also develop techniques which enable them to be readily pushed deep inside the recently developed FP-growth algorithm for frequent itemset mining. Results from our detailed experiments show the effectiveness of the techniques developed."
44,"Sequential pattern mining is an important data mining problem with broad applications. However, it, is also a challenging problem since the mining may have to generate or examine a combinatorially explosive number of intermediate subsequences. Recent studies have developed two major classes of sequential pattern mining methods: (1) a candidate generation-and-test approach, represented by (i) GSP, a horizontal format-based sequential pattern mining method, and (ii) SPADE, a vertical format-based method; and (2) a pattern-growth method, represented by PrefixSpan and its further extensions, such as gSpan for mining structured patterns.In this study, we perform a systematic introduction and presentation of the pattern-growth methodology and study its principles and extensions. We first introduce two interesting pattern-growth algorithms, FreeSpan mid PrefixSpan, for efficient sequential pattern mining. Then we introduce gSpan for mining structured patterns using the same methodology. Their relative performance in large databases is presented and analyzed. Several extensions of these methods are also discussed in the paper, including mining multi-level, multi-dimensional patterns and mining constraint-based patterns."
