id,author,year,text
193,2,2004,"In this paper, we extend the traditional association rule problem by allowing a weight to be associated with each item in a transaction to reflect the interest/intensity of each item within the transaction. In turn, this provides us with an opportunity to associate a weight parameter with each item in a resulting association rule; we call them weighted association rules (WAR). One example of such a rule might be 80% of people buying more than three bottles of soda will also be likely to buy more than four packages of snack food, while a conventional association rule might just be 60% of people buying soda will be also be likely to buy snack food. Thus WARs cannot only improve the confidence of the rules, but also provide a mechanism to do more effective target marketing by identifying or segmenting customers based on their potential degree of loyalty or volume of purchases. Our approach mines WARs by first ignoring the weight and finding the frequent itemsets (via a traditional frequent itemset discovery algorithm), followed by introducing the weight during the rule generation. Specifically, the rule generation is achieved by partitioning the weight domain space of each frequent itemset into fine grids, and then identifying the popular regions within the domain space to derive WARs. This approach does not only support the batch mode mining, i.e., finding WARs for the dataset, but also supports the interactive mode, i.e., finding and refining WARs for a given (set) of frequent itemset(s)."
194,2,2004,"In this paper, we discuss the merits of building text categorization systems by using supervised clustering techniques. Traditional approaches for document classification on a predefined set of classes are often unable to provide sufficient accuracy because of the difficulty of fitting a manually categorized collection of documents in a given classification model. This is especially the case for heterogeneous collections of Web documents which have varying styles, vocabulary, and authorship. Hence, this paper investigates the use of clustering in order to create the set of categories and its use for classification of documents. Completely unsupervised clustering has the disadvantage that it has difficulty in isolating sufficiently fine-grained classes of documents relating to a coherent subject matter. In this paper, we use the information from a preexisting taxonomy in order to supervise the creation of a set of related clusters, though with some freedom in defining and creating the classes. We show that the advantage of using partially supervised clustering is that it is possible to have some control over the range of subjects that one would like the categorization system to address, but with a precise mathematical definition of how each category is defined. An extremely effective way then to categorize documents is to use this a priori knowledge of the definition of each category. We also discuss a new technique to help the classifier distinguish better among closely related clusters."
195,2,2004,"A clear trend of the Web is that a variety of new consumer devices with diverse processing powers, display capabilities, and network connections is gaining access to the Internet. Tailoring Web content to match the device characteristics requires functionalities for content transformation, namely transcoding, that are typically carried out by the content provider or by some proxy server at the edge. In this paper, we propose an alternative solution consisting of an intermediate infrastructure of distributed servers which collaborate in discovering, transcoding, and delivering multiple versions of Web resources to the clients. We investigate different algorithms for cooperative discovery and transcoding in the context of this intermediate infrastructure where the servers are organized in hierarchical and flat peer-to-peer topologies. We compare the performance of the proposed schemes through a flexible prototype that implements all proposed mechanisms."
196,2,2004,"It has become increasingly desirable for companies worldwide to outsource their complex e-business infrastructure under the utility computing paradigm by means of service level agreements (SLAs). A successful utility computing provider must be able not only to satisfy its customers' demand for high service-quality standards, but also to fulfill its service-quality commitments based upon business objectives (e.g., cost-effectively minimizing the exposed business impact of service level violations). This paper presents the design rationale of a business-objectives-based utility computing SLA management system, called SAM, along with implementation experiences."
197,2,2003,"Pattern-based clustering is important in many applications, such as DNA micro-array data analysis, automatic recommendation systems and target marketing systems. However, pattern-based clustering in large databases is challenging. On the one hand, there can be a huge number of clusters and many of them can be redundant and thus make the pattern-based clustering ineffective. On the other hand, the previous proposed methods may not be efficient or scalable in mining large databases. In this paper, we study the problem of maximal pattern-based clustering. Redundant clusters are avoided completely by mining only the maximal pattern-based clusters. MaPle, an efficient and scalable mining algorithm is developed. It conducts a depth-first, divide-and-conquer search and prunes unnecessary branches smartly. Our extensive performance study on both synthetic data sets and real datasets shows that maximal pattern-based clustering is effective. It reduces the number of clusters substantially. Moreover, MaPle is more efficient and scalable than the previously proposed pattern-based clustering methods in mining large databases."
198,2,2003,"Inductive learning searches an optimal hypothesis that minimizes a given loss function. It is usually assumed that the simplest hypothesis that fits the data is the best approximate to an optimal hypothesis. Since finding the simplest hypothesis is NP-hard for most representations, we generally employ various heuristics to search its closest match. Computing these heuristics incurs significant cost, making learning inefficient and unscalable for large dataset. In the same time, it is still questionable if the simplest hypothesis is indeed the closest approximate to the optimal model. Recent success of combining multiple models, such as bagging, boosting and meta-learning, has greatly improved the accuracy of the simplest hypothesis, providing a strong argument against the optimality of the simplest hypothesis. However, computing these combined hypotheses incurs significantly higher cost. In this paper, we first advert that as long as the error of a hypothesis on each example is within a range dictated by a given loss function, it can still be optimal. Contrary to common beliefs, we propose a completely random decision tree algorithm that achieves much higher accuracy than the single best hypothesis and is comparable to boosted or bagged multiple best hypotheses. The advantage of multiple random tree is its training efficiency as well as minimal memory requirement."
199,2,2003,"This paper studies the problem of building text classifiers using positive and unlabeled examples. The key feature of this problem is that there is no negative example for learning. Recently, a few techniques for solving this problem were proposed in the literature. These techniques are based on the same idea, which builds a classifier in two steps. Each existing technique uses a different method for each step. In this paper, we first introduce some new methods for the two steps, and perform a comprehensive evaluation of all possible combinations of methods of the two steps. We then propose a more principled approach to solving the problem based on a biased formulation ofSVM, and show experimentally that it is more accurate than the existing techniques."
200,2,2003,"We devise in this paper a regression-based algorithm, called algorithm FTP-DS (Frequent Temporal Patterns of Data Streams), to mine frequent temporal patterns for data streams. While providing a general framework of pattern frequency counting, algorithm FTP-DS has two major features, namely one data scan for online statistics collection and regression-based compact pattern representation. To attain the feature of one data scan, the data segmentation and the pattern growth scenarios are explored for the frequency counting purpose. Algorithm FTP-DS scans online transaction flows and generates candidate frequent patterns in real time. The second important feature of algorithm FTP-DS is on the regression-based compact pattern representation. Specifically, to meet the space constraint, we devise for pattern representation a compact ATF (standing for Accumulated Time and Frequency) form to aggregately comprise all the information required for regression analysis. In addition, we develop the techniques of the segmentation tuning and segment relaxation to enhance the functions of FTP-DS. With these features, algorithm FTP-DS is able to not only conduct mining with variable time intervals but also perform trend detection effectively. Synthetic data and a real dataset which contains net-Permission work alarm logs from a major telecommunication company are utilized to verify the feasibility of algorithm FTP-DS."
201,2,2003,"The clustering problem is a difficult problem for the data stream domain. This is because the large volumes of data arriving in a stream renders most traditional algorithms too inefficient. In recent years, a few one-pass clustering algorithms have been developed for the data stream problem. Although such methods address the scalability issues of the clustering problem, they are generally blind to the evolution of the data and do not address the following issues: (1) The quality of the clusters is poor when the data evolves considerably over time. (2) A data stream clustering algorithm requires much greater functionality in discovering and exploring clusters over different portions of the stream."
202,2,2003,"In this paper, we study the problem of applying data mining to facilitate the investigation of money laundering crimes (MLCs). We have identified a new paradigm of problems that of automatic community generation based on uni-party data, the data in which there is no direct or explicit link information available. Consequently, we have proposed a new methodology for Link Discovery based on Correlation Analysis (LDCA). We have used MLC group model generation as an exemplary application of this problem paradigm, and have focused on this application to develop a specific method of automatic MLC group model generation based on timeline analysis using the LDCA methodology, called CORAL. A prototype of CORAL method has been implemented, and preliminary testing and evaluations based on a real MLC case data are reported. The contributions of this work are: (1) identification of the uni-party data community generation problem paradigm, (2) proposal of a new methodology LDCA to solve for problems in this paradigm, (3) formulation of the MLC group model generation problem as an example of this paradigm, (4) application of the LDCA methodology in developing a specific solution (CORAL) to the MLC group model generation problem, and (5) development, evaluation, and testing of the CORAL prototype in a real MLC case data."
203,2,2003,"Recently, mining data streams with concept drifts for actionable insights has become an important and challenging task for a wide range of applications including credit card fraud protection, target marketing, network intrusion detection, etc. Conventional knowledge discovery tools are facing two challenges, the overwhelming volume of the streaming data, and the concept drifts. In this paper, we propose a general framework for mining concept-drifting data streams using weighted ensemble classifiers. We train an ensemble of classification models, such as C4.5, RIPPER, naive Bayesian, etc., from sequential chunks of the data stream. The classifiers in the ensemble are judiciously weighted based on their expected classification accuracy on the test data under the time-evolving environment. Thus, the ensemble approach improves both the efficiency in learning the model and the accuracy in performing classification. Our empirical study shows that the proposed methods have substantial advantage over single-classifier approaches in prediction accuracy, and the ensemble framework is effective for a variety of classification models."
204,2,2003,"Most recent research of scalable inductive learning on very large dataset, decision tree construction in particular, focuses on eliminating memory constraints and reducing the number of sequential data scans. However, state-of-the-art decision tree construction algorithms still require multiple scans over the data set and use sophisticated control mechanisms and data structures. We first discuss a general inductive learning framework that scans the dataset exactly once. Then, we propose an extension based on Hoeffding's inequality that scans the dataset less than once. Our frameworks are applicable to a wide range of inductive learners."
205,2,2003,"The large variety of devices that are gaining access to the Internet requires novel server functionalities to tailorWeb content at run-time, namely transcoding. Traditional schemes assign transcoding operations to the Web server or single edge proxies. We propose an alternative architecture consisting of cooperative proxy servers which collaborate in discovering and transcoding multiple versions of Web objects. The transcoding functionality opens an entirely new space of investigation in the research area of cache cooperation, because it transforms the proxy servers from content repositories into pro-active network elements providing computation and adaptive delivery. We investigate and evaluate experimentally different schemes for cooperative discovery of multi-version content and transcoding in the context of a flat topology of edge servers."
206,2,2003,"With the growing importance of XML in data exchange, much research has been done in providing flexible query facilities to extract data from structured XML documents. In this paper, we propose ViST, a novel index structure for searching XML documents. By representing both XML documents and XML queries in structure-encoded sequences, we show that querying XML data is equivalent to finding subsequence matches. Unlike index methods that disassemble a query into multiple sub-queries, and then join the results of these sub-queries to provide the final answers, ViST uses tree structures as the basic unit of query to avoid expensive join operations. Furthermore, ViST provides a unified index on both content and structure of the XML documents, hence it has a performance advantage over methods indexing either just content or structure. ViST supports dynamic index update, and it relies solely on B+ Trees without using any specialized data structures that are not well supported by DBMSs. Our experiments show that ViST is effective, scalable, and efficient in supporting structural queries."
207,2,2003,"This paper introduces new algorithms specifically designed for content-based publication-subscription systems. These algorithms can be used to determine multicast groups with as much commonality as possible, based on the totality of subscribers' interests. The algorithms are based on concepts borrowed from the literature on spatial databases and clustering. These algorithms perform well in the context of highly heterogeneous subscriptions, and they also scale well. Based on concepts borrowed from the spatial database literature, we develop an algorithm to match publications to subscribers in real-time. We also investigate the benefits of dynamically determining whether to unicast, multicast or broadcast information about the events over the network to the matched subscribers. We call this the distribution method problem. Some of these same concepts can be applied to match publications to subscribers in real-time, and also to determine dynamically whether to unicast, multicast or broadcast information about the events over the network to the match subscribers. We demonstrate the quality of our algorithms via a number of realistic simulation experiments."
208,2,2003,"With the proliferation of wireless devices, mobile ad-hoc networking (MANET) has become a very exciting and important technology. However, MANET is more vulnerable than wired networking. Existing security mechanisms designed for wired networks have to be redesigned in this new environment. In this paper, we discuss the problem of intrusion detection in MANET. The focus of our research is on techniques for automatically constructing anomaly detection models that are capable of detecting new (or unseen)attacks. We introduce a new data mining method that performs\""cross-feature analysis\"" to capture the inter-feature correlation patterns in normal traffic. These patterns can be used as normal profiles to detect deviation (or anomalies)caused by attacks. We have implemented our method on a few well known ad-hoc routing protocols, namely, DynamicSource Routing (DSR) and Ad-hoc On-Demand DistanceVector (AODV), and have conducted extensive experiments on the ns-2 simulator. The results show that the anomaly detection models automatically computed using our data mining method can effectively detect anomalies caused by typical routing intrusions."
209,2,2003,"It is imperative for a competitive e-business service provider to be positioned to manage the execution of its service level agreement (SLA) contracts in business terms (e.g., minimizing financial penalties for service-level violations, maximizing service-level measurement based customer satisfaction metrics). This paper briefly describes the design rationale of an integrated set of business-oriented service level management (SLM) technologies under development in the SAM project at IBM T.J. Watson Research Center. The e-business SLA execution manager SAM, (1) enables the provider to deploy an effective means of capturing and managing contractual SLA data as well as provider-facing non-contractual SLM data; (2)assists service personnel to prioritize the processing of action-demanding quality management alerts as per the provider's SLM objectives; and (3) automates the prioritization and execution management of approved SLM processes on behalf of the provider, including assigning SLM tasks to service personnel."
210,2,2003,"Replication of information among multiple servers is necessary to support high request rates to popular Web sites. We consider systems that maintain one interface to the users, even if they consist of multiple nodes with visible IP addresses that are distributed among different networks. In these systems, the first-level dispatching is achieved through the Domain Name System (DNS) during the address lookup phase. Distributed Web systems can use some request redirection mechanism as a second-level dispatching because the DNS routing scheme has limited control on offered load. Redirection is always executed by the servers, but there are many alternatives that are worth of investigation. In this paper, we explore the combination of DNS dispatching with redirection schemes that use centralized or distributed control on the basis of global or local state information. In the fully distributed schemes, DNS dispatching is carried out by simple algorithms because load sharing are taken by some redirection mechanisms that each server activates autonomously. On the other hand, in fully centralized schemes, redirection is used as a tool to enforce the decisions taken by the same centralized entity that provides the first-level dispatching. We also investigate some hybrid strategies. We conclude that the distributed algorithms are preferable over the centralized counterpart because they provide stable performance, can take content-aware dispatching decisions, can limit the percentage of redirected requests and, last, but not least, their implementation is much simpler than that required by the centralized schemes."
211,2,2003,"Microarrays are one of the latest breakthroughs in experimental molecular biology, which provide a powerful tool by which the expression patterns of thousands of genes can be monitored simultaneously and are already producing huge amount of valuable data. The concept of bicluster was introduced by Cheng and Church (2000) to capture the coherence of a subset of genes and a subset of conditions. A set of heuristic algorithms were also designed to either find one bicluster or a set of biclusters, which consist of iterations of masking null values and discovered biclusters, coarse and fine node deletion, node addition, and the inclusion of inverted data. These heuristics inevitably suffer from some serious drawback. The masking of null values and discovered biclusters with random numbers may result in the phenomenon of random interference which in turn impacts the discovery of high quality biclusters. To address this issue and to further accelerate the biclustering process, we generalize the model of bicluster to incorporate null values and propose a probabilistic algorithm (FLOC) that can discover a set of k possibly overlapping biclusters simultaneously. Furthermore, this algorithm can easily be extended to support additional features that suit different requirements at virtually little cost. Experimental study on the yeast gene expression data shows that the FLOC algorithm can offer substantial improvements over the previously proposed algorithm."
212,2,2003,"Periodicy detection in time series data is a challenging problem of great importance in many applications. Most previous work focused on mining synchronous periodic patterns and did not recognize the misaligned presence of a pattern due to the intervention of random noise. In this paper, we propose a more flexible model of asynchronous periodic pattern that may be present only within a subsequence and whose occurrences may be shifted due to disturbance. Two parameters min_rep and max_dis are employed to specify the minimum number of repetitions that is required within each segment of nondisrupted pattern occurrences and the maximum allowed disturbance between any two successive valid segments. Upon satisfying these two requirements, the longest valid subsequence of a pattern is returned. A two-phase algorithm is devised to first generate potential periods by distance-based pruning followed by an iterative procedure to derive and validate candidate patterns and locate the longest valid subsequence. We also show that this algorithm cannot only provide linear time complexity with respect to the length of the sequence but also achieve space efficiency."
213,2,2003,"In many data mining applications, the objective is to select data cases of a target class. For example, in direct marketing, marketers want to select likely buyers of a particular product for promotion. In such applications, it is often too difficult to predict who will definitely be in the target class (e.g., the buyer class) because the data used for modeling is often very noisy and has a highly imbalanced class distribution. Traditionally, classification systems are used to solve this problem. Instead of classifying each data case to a definite class (e.g., buyer or non-buyer), a classification system is modified to produce a class probability estimate (or a score) for the data case to indicate the likelihood that the data case belongs to the target class (e.g., the buyer class). However, existing classification systems only aim to find a subset of the regularities or rules that exist in data. This subset of rules only gives a partial picture of the domain. In this paper, we show that the target selection problem can be mapped to association rule mining to provide a more powerful solution to the problem. Since association rule mining aims to find all rules in data, it is thus able to give a complete picture of the underlying relationships in the domain. The complete set of rules enables us to assign a more accurate class probability estimate to each data case. This paper proposes an effective and efficient technique to compute class probability estimates using association rules. Experiment results using public domain data and real-life application data show that in general the new technique performs markedly better than the state-of-the-art classification system C4.5, boosted C4.5, and the Naïve Bayesian system."
214,2,2003,"Hash routing is an emerging approach to coordinating a collection of collaborative proxy caches. Hash routing partitions the entire URL space among the proxy caches. Each partition is assigned to a cache server. Duplication of cache contents is eliminated. Client requests to a cache server for non-assigned-partition objects are forwarded to proper sibling caches. In the presence of access skew, the load level of the cache servers can be quite unbalanced, limiting the benefits of hash routing."
