id,author,year,text
255,2,2000,"High dimensional data has always been a challenge for clustering algorithms because of the inherent sparsity of the points. Recent research results indicate that in high dimensional data, even the concept of proximity or clustering may not be meaningful. We discuss very general techniques for projected clustering which are able to construct clusters in arbitrarily aligned subspaces of lower dimensionality. The subspaces are specific to the clusters themselves. This definition is substantially more general and realistic than currently available techniques which limit the method to only projections from the original set of attributes. The generalized projected clustering technique may also be viewed as a way of trying to redefine clustering for high dimensional applications by searching for hidden subspaces with clusters which are created by inter-attribute correlations. We provide a new concept of using extended cluster feature vectors in order to make the algorithm scalable for very large databases. The running time and space requirements of the algorithm are adjustable, and are likely to tradeoff with better accuracy."
256,2,2000,"High dimensional data has always been a challenge for clustering algorithms because of the inherent sparsity of the points. Recent research results indicate that in high dimensional data, even the concept of proximity or clustering may not be meaningful. We discuss very general techniques for projected clustering which are able to construct clusters in arbitrarily aligned subspaces of lower dimensionality. The subspaces are specific to the clusters themselves. This definition is substantially more general and realistic than currently available techniques which limit the method to only projections from the original set of attributes. The generalized projected clustering technique may also be viewed as a way of trying to redefine clustering for high dimensional applications by searching for hidden subspaces with clusters which are created by inter-attribute correlations. We provide a new concept of using extended cluster feature vectors in order to make the algorithm scalable for very large databases. The running time and space requirements of the algorithm are adjustable, and are likely to tradeoff with better accuracy."
257,2,2000,"Many diverse small devices, such as smart phones and personal digital assistants, are being deployed to access the Internet. Small devices typically have limited display and processing capabilities. It is thus difficult to effectively present a large table of information on these different devices such that the users can easily browse the table. In this paper, we present the design and prototype implementation of TabSum, a flexible and dynamic table summarization approach to reducing tables into smaller but still meaningful representations for various devices. TabSum supports easy browsing of a large table by various devices and provides personalization by taking into account both device capabilities and user preferences. A multi-source multi-layered specification methodology is proposed to describe summarization rules preferred by various sources. Upon requests, a set of table reduction rules is dynamically applied to the rows and columns of a table to reduce its size. The approach is flexible and dynamic. It summarizes both numeric and non-numeric data types."
258,2,2000,"In this paper, we examine the issue of robust transaction routing in distributed database systems. A class of dynamic routing strategies which use estimated response times to make routing decisions is studied in details. Since response time estimation and decision making depend on the assumed transaction model and parameters, it is important to examine the robustness or sensitivity to the inaccuracy in the assumptions and parameter values. Through simulations, we find that the dynamic routing strategy based strictly on response time is too aggressive in sharing loads and makes too many non-preferred system routings. It is robust with respect to change in the number of database calls per transaction, but is relatively sensitive to the distribution of database calls. Two refinements are proposed which improve system performance as well as robustness of routing decisions."
259,2,2000,"Skew in the distribution of values taken by an attribute is identified as a major factor that can affect the performance of parallel architectures for relational joins. The effect of skew on the performance of two parallel architectures is evaluated using analytic models. In one architecture, called database machine (DBMC), data as well as processing power are distributed; while in the other architecture, called Single Processor Parallel Input/output (SPPI), data is distributed but the processing power is concentrated in one processor. The two architectures are compared in terms of the ratio of MIPS used by DBMC and SPPI to deliver the same throughput and response time. In addition, the horizontal growth potential of DBMC is evaluated in terms of maximum speedup achievable by DBMC relative to SPPI response time. The MIPS ratio as well as speedup are found to be very sensitive to the amount of skew. These suggest, careful thought should be given in parallelizing database applications and in the design of algorithms and query optimizer for parallel architectures."
260,2,1999,"This paper studies controlled local replication for hash routing, such as CARP, among a collection of loosely-coupled proxy web cache servers. Hash routing partitions the entire URL space among the shared web caches, creating a single logical cache. Each partition is assigned to a cache server. Duplication of cache contents is eliminated and total incoming traffic to the shared web caches is minimized. Client requests for non-assigned-partition objects are forwarded to sibling caches. However, request forwarding increases not only inter-cache traffic but also cpu utilization, thus slows the client response time. We propose a controlled local replication of non-assigned-partition objects in each cache server to effectively reduce the inter-cache traffic. We use a multiple-exit LRU to implement controlled local replication. Trace-driven simulations are conducted to study the performance impact of local replication. The results show that (1) regardless of cache sizes, with a controlled local replication, the average response time, inter-cache traffic and CPU overhead can be effectively reduced without noticeable increases in incoming traffic; (2) for very large cache sizes, a larger amount of local replication can be allowed to reduce inter-cache traffic without increasing incoming traffic; and (3) local replication is effective even if clients are dynamically assigned to different cache servers."
261,2,1999,"We study the performance of various run placement policies on disks for the merge phase of concurrent mergesorts using parallel prefetching. The initial sorted runs (input) of a merge and its final sorted run (output) are stored on multiple disks but each run resides only on a single disk. In this paper, we examine through detailed simulations three different run placement policies and the impact of buffer thrashing. The results show that, with buffer thrashing avoidance, the best performance can be achieved by a run placement policy that uses a proper subset of the disks dedicated for writing the output runs while the rest of the disks are used for prefetching the input runs in parallel. However, the proper number of write disks is workload dependent, and if not carefully chosen, it can adversely affect the system performance. In practice, a reasonably good performance can be achieved by a run placement policy that does not place the output run of a merge on any of the disks that store its own input runs but allows the output run to share the same disk with some of the input runs of other merges."
262,2,1999,"In this paper we introduce a new multidimensional index structure called the S-tree. Such indexes are appropriate for a large variety of pictorial databases such as cartography, satellite and medical images. The S-tree discussed in this paper is similar in flavor to the standard R-tree, but accepts mild imbalance in the resulting tree in return for a significantly reduced area, overlap and perimeter in the resulting minimum bounding rectangles. In fact, the S-tree is defined in terms of a parameter which governs the degree to which this trade-off is allowed. We develop an efficient packing algorithm based on this parameter. We then analyze the S-tree analytically, giving theoretical bounds on the degree of imbalance of the tree. We also analyze the S-tree experimentally. The S-tree does well in two dimensions, and even better in three dimensions. Indeed, the S-tree can be expected to do better still as the dimensionality increases. While the S-tree is extremely effective for static databases, we outline the extension to dynamic databases as well."
263,2,1999,"In recent years, many data mining methods have been proposed for finding useful and structured information from market basket data. The association rule model was recently proposed in order to discover useful patterns and dependencies in such data. This paper discusses a method for indexing market basket data efficiently for similarity search. The technique is likely to be very useful in applications which utilize the similarity in customer buying behavior in order to make peer recommendations. We propose an index called the signature table, which is very flexible in supporting a wide range of similarity functions. The construction of the index structure is independent of the similarity function, which can be specified at query time. The resulting similarity search algorithm shows excellent scalability with increasing memory availability and database size."
264,2,1999,"The clustering problem is well known in the database literature for its numerous applications in problems such as customer segmentation, classification and trend analysis. Unfortunately, all known algorithms tend to break down in high dimensional spaces because of the inherent sparsity of the points. In such high dimensional spaces not all dimensions may be relevant to a given cluster. One way of handling this is to pick the closely correlated dimensions and find clusters in the corresponding subspace. Traditional feature selection algorithms attempt to achieve this. The weakness of this approach is that in typical high dimensional data mining applications different sets of points may cluster better for different subsets of dimensions. The number of dimensions in each such cluster-specific subspace may also vary. Hence, it may be impossible to find a single small subset of dimensions for all the clusters. We therefore discuss a generalization of the clustering problem, referred to as the projected clustering problem, in which the subsets of dimensions selected are specific to the clusters themselves. We develop an algorithmic framework for solving the projected clustering problem, and test its performance on synthetic data."
265,2,1999,"Popular Web sites cannot rely on a single powerful server nor on independent mirrored-servers to support the ever-increasing request load. Distributed Web server architectures that transparently schedule client requests offer a way to meet dynamic scalability and availability requirements. The authors review the state of the art in load balancing techniques on distributed Web-server systems, and analyze the efficiencies and limitations of the various approaches"
266,2,1999,"In this paper, a hierarchical algorithm, HierarchyScan, is proposed to efficiently locate one-dimensional subsequences within a collection of sequences with arbitrary length. The proposed algorithm performs correlation between the stored sequences and the template pattern in the transformed domain to identify subsequences in a scale- and phase-independent fashion. This is in contrast to those approaches based on the computation of Euclidean distance in the transformed domain. In the proposed hierarchical algorithm, the transformed domain representation of each original sequence is divided into multiple groups of coefficients. The matching is performed hierarchically from the group with the greatest filtering capability to the group with the lowest filtering capability. Only those subsequences whose maximum correlation value is higher than a predefined threshold will be selected for additional screening. This approach is compared to the sequential scanning and an order-of-magnitude speedup is observed."
267,2,1999,"This paper provides a survey of various data mining techniques for advanced database applications. These include association rule generation, clustering and classification. With the recent increase in large online repositories of information, such techniques have great importance. The focus is on high dimensional data spaces with large volumes of data. The paper discusses past research on the topic and also studies the corresponding algorithms and applications."
268,2,1999,"Data mining has become increasingly popular and is widely used in various application areas. In this paper, we examine new developments in data mining and its application to personalization in E-commerce. Personalization is what merchants and publishers want to do to tailor the Web site or advertisement and product promotion to a customer based on his past behavior and inference from other like-minded people. E-commerce offers the opportunity to deploy this type of one-to-one marketing instead of the traditional mass marketing. The technology challenges to support personalization will be discussed. These include the need to perform clustering and searching in very high dimensional data space with huge amount of data. We'll examine some of the new data mining technologies developed that can support personalization."
269,2,1999,"Replication of information across a server cluster provides a promising way to support popular Web sites. However, a Web-server cluster requires some mechanism for the scheduling of requests to the most available server. One common approach is to use the cluster Domain Name System (DNS) as a centralized dispatcher. The main problem is that WWW address caching mechanisms (although reducing network traffic) only let this DNS dispatcher control a very small fraction of the requests reaching the Web-server cluster. The non-uniformity of the load from different client domains, and the high variability of real Web workload introduce additional degrees of complexity to the load balancing issue. These characteristics make existing scheduling algorithms for traditional distributed systems not applicable to control the load of Web-server clusters and motivate the research on entirely new DNS policies that require some system state information. We analyze various DNS dispatching policies under realistic situations where state information needs to be estimated with low computation and communication overhead so as to be applicable to a Web cluster architecture. In a model of realistic scenarios for the Web cluster, a large set of simulation experiments shows that, by incorporating the proposed state estimators into the dispatching policies, the effectiveness of the DNS scheduling algorithms can improve substantially, in particular if compared to the results of DNS algorithms not using adequate state information."
270,2,1999,"Consider a system of independent tasks to be scheduled without preemption on a parallel computer.  For each task the number of processors required, the execution time, and a weight are known. The problem is to find a schedule with minimum weighted average response time. We present an algorithm called SMART (which stands for scheduling to minimize average response time) for this problem that produces solutions that are within a factor of 8.53 of optimal. To our knowledge this is the first polynomial-time algorithm for the minimum weighted average response time problem that achieves a constant bound. In addition, for the unweighted case (that is, where all the weights are unity) we describe a variant of SMART that produces solutions that are within a factor of 8 of optimal, improving upon the best known bound of 32 for this special case."
271,2,1999,"With the recent explosion in usage of the World Wide Web, the problem of caching Web objects has gained considerable importance. Caching on the Web differs from traditional caching in several ways. The nonhomogeneity of the object sizes is probably the most important such difference. In this paper, we give an overview of caching policies designed specifically for Web objects and provide a new algorithm of our own. This new algorithm can be regarded as a generalization of the standard LRU algorithm. We examine the performance of this and other Web caching algorithms via event- and trace-driven simulation."
272,2,1998,"Caching data in a wireless mobile computer can significantly reduce  the bandwidth requirement. However, due to battery power limitation,  a wireless mobile computer may often be forced to operate in a doze or  even totally disconnected mode. As a result, the mobile computer may  miss some cache invalidation reports. In this paper, we present an  energy-efficient cache invalidation method for a wireless mobile  computer. The new cache invalidation scheme is called grouping with  cold update-set retention (GCORE). Upon waking up, a mobile computer  checks its cache validity with the server. To reduce the bandwidth  requirement for validity checking, data objects are partitioned into  groups. However, instead of simply invalidating a group if any of the  objects in the group has been updated, GCORE retains the cold update  set of objects in a group if possible. We present an efficient  implementation of GCORE and conduct simulations to evaluate its  caching effectiveness. The results show that GCORE can substantially  improve mobile caching by reducing the communication bandwidth (thus  energy consumption) for query processing."
273,2,1998,The results discussed in this paper are relevant to a large database consisting of consumer profile information together with behavioral (transaction) patterns. The focus of this paper is on the problem of online mining of profile association rules in this large database. The profile association rule problem is closely related to the quantitative association rule problem. We show how to use multidimensional indexing structures in order to perform the mining. The use of multidimensional indexing structures to perform profile mining provides considerable advantages in terms of the ability to perform very generic range based online queries.
274,2,1998,"A distributed multiserver Web site can provide the scalability necessary to keep up with growing client demand at popular sites. Load balancing of these distributed Web-server systems, consisting of multiple, homogeneous Web servers for document retrieval and a Domain Name Server (DNS) for address resolution, opens interesting new problems. In this paper, we investigate the effects of using a more active DNS which, as an atypical centralized scheduler, applies some scheduling strategy in routing the requests to the most suitable Web server. Unlike traditional parallel/distributed systems in which a centralized scheduler has full control of the system, the DNS controls only a very small fraction of the requests reaching the multiserver Web site. This peculiarity, especially in the presence of highly skewed load, makes it very difficult to achieve acceptable load balancing and avoid overloading some Web servers. This paper adapts traditional scheduling algorithms to the DNS, proposes new policies, and examines their impact under different scenarios. Extensive simulation results show the advantage of strategies that make scheduling decisions on the basis of the domain that originates the client requests and limited server state information (e.g., whether a server is overloaded or not). An initially unexpected result is that using detailed server information, especially based on history, does not seem useful in predicting the future load and can often lead to degraded performance."
275,2,1998,"With ever increasing Web traffic, a distributed multi-server Web site can provide scalability and flexibility to cope with growing client demands. Load balancing algorithms to spread the requests across multiple Web servers are crucial to achieve the scalability. Various domain name server (DNS) based schedulers have been proposed in the literature, mainly for multiple homogeneous servers. The presence of heterogeneous Web servers not only increases the complexity of the DNS scheduling problem, but also makes previously proposed algorithms for homogeneous distributed systems not directly applicable. This leads us to propose new policies, called adaptive TTL algorithms, that take into account of both the uneven distribution of client request rates and heterogeneity of Web servers to adaptively set the time-to-live (TTL) value for each address mapping request. Extensive simulation results show that these strategies are robust and effective in balancing load among geographically distributed heterogeneous Web servers."
276,2,1998,"In this paper, we explore a new data mining capability that involves mining path traversal patterns in a distributed information-providing environment where documents or objects are linked together to facilitate interactive access. Our solution procedure consists of two steps. First, we derive an algorithm to convert the original sequence of log data into a set of maximal forward references. By doing so, we can filter out the effect of some backward references, which are mainly made for ease of traveling and concentrate on mining meaningful user access sequences. Second, we derive algorithms to determine the frequent traversal patterns i.e., large reference sequences from the maximal forward references obtained. Two algorithms are devised for determining large reference sequences; one is based on some hashing and pruning techniques, and the other is further improved with the option of determining large reference sequences in batch so as to reduce the number of database scans required. Performance of these two methods is comparatively analyzed. It is shown that the option of selective scan is very advantageous and can lead to prominent performance improvement. Sensitivity analysis on various parameters is conducted."
277,2,1997,"In a video-on-demand (VOD) environment, disk arrays are often used to support the disk bandwidth requirement. This can pose serious problems on available disk bandwidth upon disk failure. In this paper, we explore the approach of replicating frequently accessed movies to provide high data bandwidth and fault tolerance required in a disk-array-based video server. An isochronous continuous video stream imposes different requirements from a random access pattern on databases or files. Explicitly, we propose a new replica placement method, called rotational mirrored declustering (RMD), to support high data availability for disk arrays in a VOD environment. In essence, RMD is similar to the conventional mirrored declustering in that replicas are stored in different disk arrays. However, it is different from the latter in that the replica placements in different disk arrays under RMD are properly rotated. Combining the merits of prior chained and mirrored declustering methods, RMD is particularly suitable for storing multiple movie copies to support VOD applications. To assess the performance of RMD, we conduct a series of experiments by emulating the storage and delivery of movies in a VOD system. Our results show that RMD consistently outperforms the conventional methods in terms of load-balancing and fault-tolerance capability after disk failure, and is deemed a viable approach to supporting replica placement in a disk-array-based video server."
278,2,1997,"For a video-on-demand computer system, we propose a scheme which balances the load on the disks, thereby helping to solve a performance problem crucial to achieving maximal video throughput. Our load-balancing scheme consists of two components. The static component determines good assignments of videos to groups of striped disks. The dynamic component uses these assignments, and features a\""DASD dancing\"" algorithm which performs real-time disk scheduling in an effective manner. Our scheme works synergistically with disk striping. We examine the performance of the proposed algorithm via simulation experiments."
