id,author,year,text
1,1,2005,"Graphs have become increasingly important in modeling complicated structures and schemaless data such as chemical compounds, proteins, and XML documents. Given a graph query, it is desirable to retrieve graphs quickly from a large database via indices. In this article, we investigate the issues of indexing graphs and propose a novel indexing model based on discriminative frequent structures that are identified through a graph mining process. We show that the compact index built under this model can achieve better performance in processing graph queries. Since discriminative frequent structures capture the intrinsic characteristics of the data, they are relatively stable to database updates, thus facilitating sampling-based feature extraction and incremental index maintenance. Our approach not only provides an elegant solution to the graph indexing problem, but also demonstrates how database indexing and query processing can benefit from data mining, especially frequent pattern mining. Furthermore, the concepts developed here can be generalized and applied to indexing sequences, trees, and other complicated structures as well."
2,1,2005,"We propose a novel document clustering method which aims to cluster the documents into different semantic classes. The document space is generally of high dimensionality and clustering in such a high dimensional space is often infeasible due to the curse of dimensionality. By using Locality Preserving Indexing (LPI), the documents can be projected into a lower-dimensional semantic space in which the documents related to the same semantics are close to each other. Different from previous document clustering methods based on Latent Semantic Indexing (LSI) or Nonnegative Matrix Factorization (NMF), our method tries to discover both the geometric and discriminating structures of the document space. Theoretical analysis of our method shows that LPI is an unsupervised approximation of the supervised Linear Discriminant Analysis (LDA) method, which gives the intuitive motivation of our method. Extensive experimental evaluations are performed on the Reuters-21578 and TDT2 data sets."
3,1,2005,"We consider the problem of image representation and clustering. Traditionally, an n1 x n2 image is represented by a vector in the Euclidean space ? n1 x n2. Some learning algorithms are then applied to these vectors in such a high dimensional space for dimensionality reduction, classification, and clustering. However, an image is intrinsically a matrix, or the second order tensor. The vector representation of the images ignores the spatial relationships between the pixels in an image. In this paper, we introduce a tensor framework for image analysis. We represent the images as points in the tensor space Rn1 mathcal Rn2 which is a tensor product of two vector spaces. Based on the tensor representation, we propose a novel image representation and clustering algorithm which explicitly considers the manifold structure of the tensor space. By preserving the local structure of the data manifold, we can obtain a tensor subspace which is optimal for data representation in the sense of local isometry. We call it TensorImage approach. Traditional clustering algorithm such as k-means is then applied in the tensor subspace. Our algorithm shares many of the data representation and clustering properties of other techniques such as Locality Preserving Projections, Laplacian Eigenmaps, and spectral clustering, yet our algorithm is much more computationally efficient. Experimental results show the efficiency and effectiveness of our algorithm."
4,1,2005,"Support vector machines (SVMs) have been promising methods for classification and regression analysis due to their solid mathematical foundations, which include two desirable properties: margin maximization and nonlinear classification using kernels. However, despite these prominent properties, SVMs are usually not chosen for large-scale data mining problems because their training complexity is highly dependent on the data set size. Unlike traditional pattern recognition and machine learning, real-world data mining applications often involve huge numbers of data records. Thus it is too expensive to perform multiple scans on the entire data set, and it is also infeasible to put the data set in memory. This paper presents a method,  Clustering-Based SVM (CB-SVM) , that maximizes the SVM performance for very large data sets given a limited amount of resource, e.g., memory. CB-SVM applies a hierarchical micro-clustering algorithm that scans the entire data set only once to provide an SVM with high quality samples. These samples carry statistical summaries of the data and maximize the benefit of learning. Our analyses show that the training complexity of CB-SVM is quadratically dependent on the number of support vectors, which is usually much less than that of the entire data set. Our experiments on synthetic and real-world data sets show that CB-SVM is highly scalable for very large data sets and very accurate in terms of classification."
5,1,2005,"Social network analysis has attracted much attention in recent years. Community mining is one of the major directions in social network analysis. Most of the existing methods on community mining assume that there is only one kind of relation in the network, and moreover, the mining results are independent of the users' needs or preferences. However, in reality, there exist multiple, heterogeneous social networks, each representing a particular kind of relationship, and each kind of relationship may play a distinct role in a particular task. In this paper, we systematically analyze the problem of mining hidden communities on heterogeneous social networks. Based on the observation that different relations have different importance with respect to a certain query, we propose a new method for learning an optimal linear combination of these relations which can best meet the user's expectation. With the obtained relation, better performance can be achieved for community mining."
6,1,2005,"With the fast expansion of computer networks, it is inevitable to study data mining on heterogeneous databases. In this paper we propose MDBM, an accurate and efficient approach for classification on multiple heterogeneous databases. We propose a regression-based method for predicting the usefulness of inter-database links that serve as bridges for information transfer, because such links are automatically detected and may or may not be useful or even valid. Because of the high cost of inter-database communication, MDBM employs a new strategy for cross-database classification, which finds and performs actions with high benefit-to-cost ratios. The experiments show that MDBM achieves high accuracy in cross-database classification, with much higher efficiency than previous approaches."
7,1,2005,"Existing methods for top-k ranked query employ techniques including sorting, updating thresholds and materializing views. In this paper, we propose two novel index-based techniques for top-k ranked query: (1) indexing the layered skyline, and (2) indexing microclusters of objects into a grid structure. We also develop efficient algorithms for ranked query by locating the answer points during the sweeping of the line/hyperplane of the score function over the indexed objects. Both methods can be easily plugged into typical multi-dimensional database indexes. The comprehensive experiments not only demonstrate that our methods outperform the existing ones, but also illustrate that the application of data mining technique (microclustering) is a useful and effective solution for database query processing."
8,1,2005,"Real-time surveillance systems, telecommunication systems, and other dynamic environments often generate tremendous (potentially infinite) volume of stream data: the volume is too huge to be scanned multiple times. Much of such data resides at rather low level of abstraction, whereas most analysts are interested in relatively high-level dynamic changes (such as trends and outliers). To discover such high-level characteristics, one may need to perform on-line multi-level, multi-dimensional analytical processing of stream data. In this paper, we propose an architecture, called stream_cube, to facilitate on-line, multi-dimensional, multi-level analysis of stream data."
9,1,2005,"Automated localization of software bugs is one of the essential issues in debugging aids. Previous studies indicated that the evaluation history of program predicates may disclose important clues about underlying bugs. In this paper, we propose a new statistical model-based approach, called SOBER, which localizes software bugs without any prior knowledge of program semantics. Unlike existing statistical debugging approaches that select predicates correlated with program failures, SOBER models evaluation patterns of predicates in both correct and incorrect runs respectively and regards a predicate as bug-relevant if its evaluation pattern in incorrect runs differs significantly from that in correct ones. SOBER features a principled quantification of the pattern difference that measures the bug-relevance of program predicates. We systematically evaluated our approach under the same setting as previous studies. The result demonstrated the power of our approach in bug localization: SOBER can help programmers locate 68 out of 130 bugs in the Siemens suite when programmers are expected to examine no more than 10% of the code, whereas the best previously reported is 52 out of 130. Moreover, with the assistance of SOBER, we found two bugs in bc 1.06 (an arbitrary precision calculator on UNIX/Linux), one of which has never been reported before."
10,1,2005,"A major challenge in frequent-pattern mining is the sheer size of its mining results. In many cases, a high min_sup threshold may discover only commonsense patterns but a low one may generate an explosive number of output patterns, which severely restricts its usage. In this paper, we study the problem of compressing frequent-pattern sets. Typically, frequent patterns can be clustered with a tightness measure ? (called ?-cluster), and a representative pattern can be selected for each cluster. Unfortunately, finding a minimum set of representative patterns is NP-Hard. We develop two greedy methods, RPglobal and RPlocal. The former has the guaranteed compression bound but higher computational complexity. The latter sacrifices the theoretical bounds but is far more efficient. Our performance study shows that the compression quality using RPlocal is very close to RPglobal, and both can reduce the number of closed frequent patterns by almost two orders of magnitude. Furthermore, RPlocal mines even faster than FPClose[11], a very fast closed frequent-pattern mining method. We also show that RPglobal and RPlocal can be combined together to balance the quality and efficiency."
11,1,2005,"Social network analysis has attracted much attention in recent years. Community mining is one of the major directions in social network analysis. Most of the existing methods on community mining assume that there is only one kind of relation in the network, and moreover, the mining results are independent of the users' needs or preferences. However, in reality, there exist multiple, heterogeneous social networks, each representing a particular kind of relationship, and each kind of relationship may play a distinct role in a particular task. Thus mining networks by assuming only one kind of relation may miss a lot of valuable hidden community information and may not be adaptable to the diverse information needs from different users. In this paper, we systematically analyze the problem of mining hidden communities on heterogeneous social networks. Based on the observation that different relations have different importance with respect to a certain query, we propose a new method for learning an optimal linear combination of these relations which can best meet the user's expectation. With the obtained relation, better performance can be achieved for community mining. Our approach to social network analysis and community mining represents a major shift in methodology from the traditional one, a shift from single-network, user-independent analysis to multi-network, user-dependent, and query-based analysis. Experimental results on Iris data set and DBLP data set demonstrate the effectiveness of our method."
12,1,2005,"As a potential alternative to current wet-lab technologies, DNA sequencing-by-hybridization (SBH) has received much attention from different research communities. In order to deal with real applications, experiment environments should not be considered as error-free. Previously, under the assumption of random independent hybridization errors, Leong et al. [9] presented an algorithm for sequence reconstruction which exhibits graceful degradation of output accuracy as the error rate increases. However, as the authors also admitted, a notable downside of their method is its too high computational cost. In this paper, we show that the poor efficiency of [9] is due to its mixing-up of situations with widely different characteristics and treating everything in the safest but also slowest way. Our new algorithm addresses this problem and pushes analysis down to a finer level where a more effective solution is proposed. As demonstrated by experimentations on real human genome datasets, this new methodology yields significant performance improvements and at the same time guarantees almost the same degree of output accuracy."
13,1,2005,"Classification is one of the most popular data mining tasks with a wide range of applications, and lots of algorithms have been proposed to build accurate and scalable classifiers. Most of these algorithms only take a single table as input, whereas in the real world most data are stored in multiple tables and managed by relational database systems. As transferring data from multiple tables into a single one usually causes many problems, development of multi-relational classification algorithms becomes important and attracts many researchers' interests. Existing works about extending Naïve Bayes to deal with multi-relational data either have to transform data stored in tables to main-memory Prolog facts, or limit the search space to only a small subset of real world applications. In this work, we aim at solving these problems and building an efficient, accurate Naïve Bayesian classifier to deal with data in multiple tables directly. We propose an algorithm named Graph-NB, which upgrades Naïve Bayesian classifier to deal with multiple tables directly. In order to take advantage of linkage relationships among tables, and treat different tables linked to the target table differently, a semantic relationship graph is developed to describe the relationship and to avoid unnecessary joins. Furthermore, to improve accuracy, a pruning strategy is given to simplify the graph to avoid examining too many weakly linked tables. Experimental study on both real-world and synthetic databases shows its high efficiency and good accuracy."
14,1,2005,"Discovery of sequential patterns is an essential data mining task with broad applications. Among several variations of sequential patterns, closed sequential pattern is the most useful one since it retains all the information of the complete pattern set but is often much more compact than it. Unfortunately, there is no parallel closed sequential pattern mining method proposed yet. In this paper we develop an algorithm, called Par-CSP (Parallel Closed Sequential Pattern mining), to conduct parallel mining of closed sequential patterns on a distributed memory system. Par-CSP partitions the work among the processors by exploiting the divide-and-conquer property so that the overhead of interprocessor communication is minimized. Par-CSP applies dynamic scheduling to avoid processor idling. Moreover, it employs a technique, called selective sampling to address the load imbalance problem. We implement Par-CSP using MPI on a 64-node Linux cluster. Our experimental results show that Par-CSP attains good parallelization efficiencies on various input datasets."
15,1,2005,"Clustering is an essential data mining task with numerous applications. However, data in most real-life applications are high-dimensional in nature, and the related information often spreads across multiple relations. To ensure effective and efficient high-dimensional, cross-relational clustering, we propose a new approach, called CrossClus, which performs cross-relational clustering with user's guidance. We believe that user's guidance, even likely in very simple forms, could be essential for effective high-dimensional clustering since a user knows well the application requirements and data semantics. CrossClus is carried out as follows: A user specifies a clustering task and selects one or a small set of features pertinent to the task. CrossClus extracts the set of highly relevant features in multiple relations connected via linkages defined in the database schema, evaluates their effectiveness based on user's guidance, and identifies interesting clusters that fit user's needs. This method takes care of both quality in feature extraction and efficiency in clustering. Our comprehensive experiments demonstrate the effectiveness and scalability of this approach."
16,1,2005,"Relational graphs are widely used in modeling large scale networks such as biological networks and social networks. In this kind of graph, connectivity becomes critical in identifying highly associated groups and clusters. In this paper, we investigate the issues of mining closed frequent graphs with connectivity constraints in massive relational graphs where each graph has around 10K nodes and 1M edges. We adopt the concept of edge connectivity and apply the results from graph theory, to speed up the mining process. Two approaches are developed to handle different mining requests: CloseCut, a pattern-growth approach, and splat, a pattern-reduction approach. We have applied these methods in biological datasets and found the discovered patterns interesting."
17,1,2005,"Frequent-pattern mining has been studied extensively on scalable methods for mining various kinds of patterns including itemsets, sequences, and graphs. However, the bottleneck of frequent-pattern mining is not at the efficiency but at the interpretability, due to the huge number of patterns generated by the mining process. In this paper, we examine how to summarize a collection of itemset patterns using only K representatives, a small number of patterns that a user can handle easily. The K representatives should not only cover most of the frequent patterns but also approximate their supports. A generative model is built to extract and profile these representatives, under which the supports of the patterns can be easily recovered without consulting the original dataset. Based on the restoration error, we propose a quality measure function to determine the optimal value of parameter K. Polynomial time algorithms are developed together with several optimization heuristics for efficiency improvement. Empirical studies indicate that we can obtain compact summarization in real datasets."
18,1,2005,"The goal of data mining algorithm is to discover useful information embedded in large databases. Frequent itemset mining and sequential pattern mining are two important data mining problems with broad applications. Perhaps the most efficient way to solve these problems sequentially is to apply a pattern-growth algorithm, which is a divide-and-conquer algorithm [9, 10]. In this paper, we present a framework for parallel mining frequent itemsets and sequential patterns based on the divide-and-conquer strategy of pattern growth. Then, we discuss the load balancing problem and introduce a sampling technique, called selective sampling, to address this problem. We implemented parallel versions of both frequent itemsets and sequential pattern mining algorithms following our framework. The experimental results show that our parallel algorithms usually achieve excellent speedups."
19,1,2005,"Mining frequent structural patterns from graph databases is an important research problem with broad applications. Recently, we developed an effective index structure, ADI, and efficient algorithms for mining frequent patterns from large, disk-based graph databases [5], as well as constraint-based mining techniques. The techniques have been integrated into a research prototype system GraphMiner. In this paper, we describe a demo of GraphMiner which showcases the technical details of the index structure and the mining algorithms including their efficient implementation, the mining performance and the comparison with some state-of-the-art methods, the constraint-based graph-pattern mining techniques and the procedure of constrained graph mining, as well as mining real data sets in novel applications."
20,1,2005,"Advanced database systems face a great challenge raised by the emergence of massive, complex structural data in bioinformatics, chem-informatics, and many other applications. The most fundamental support needed in these applications is the efficient search of complex structured data. Since exact matching is often too restrictive, similarity search of complex structures becomes a vital operation that must be supported efficiently. In this paper, we investigate the issues of substructure similarity search using indexed features in graph databases. By transforming the edge relaxation ratio of a query graph into the maximum allowed missing features, our structural filtering algorithm, called Grafil, can filter many graphs without performing pairwise similarity computations. It is further shown that using either too few or too many features can result in poor filtering performance. Thus the challenge is to design an effective feature set selection strategy for filtering. By examining the effect of different feature selection mechanisms, we develop a multi-filter composition strategy, where each filter uses a distinct and complementary subset of the features. We identify the criteria to form effective feature sets for filtering, and demonstrate that combining features with similar size and selectivity can improve the filtering and search performance significantly. Moreover, the concept presented in Grafil can be applied to searching approximate non-consecutive sequences, trees, and other complicated structures as well."
21,1,2005,"Sequential pattern mining has been studied extensively in the data mining community. Most previous studies require the specification of a min_support threshold for mining a complete set of sequential patterns satisfying the threshold. However, in practice, it is difficult for users to provide an appropriate min_support threshold. To overcome this difficulty, we propose an alternative mining task: mining top-k frequent closed sequential patterns of length no less than min_?, where k is the desired number of closed sequential patterns to be mined and min_? is the minimal length of each pattern. We mine the set of closed patterns because it is a compact representation of the complete set of frequent patterns. An efficient algorithm, called TSP, is developed for mining such patterns without min_support. Starting at (absolute) min_support=1, the algorithm makes use of the length constraint and the properties of top-k closed sequential patterns to perform dynamic support raising and projected database pruning. Our extensive performance study shows that TSP has high performance. In most cases, it outperforms the efficient closed sequential pattern-mining algorithm, CloSpan, even when the latter is running with the best tuned min_support threshold. Thus, we conclude that, for sequential pattern mining, mining top-k frequent closed sequential patterns without min_support is more preferable than the traditional min_support-based mining."
22,1,2005,"Sequential pattern mining has been studied extensively in the data mining community. Most previous studies require the specification of a min_support threshold for mining a complete set of sequential patterns satisfying the threshold. However, in practice, it is difficult for users to provide an appropriate min_support threshold. To overcome this difficulty, we propose an alternative mining task: mining top-k frequent closed sequential patterns of length no less than min_?, where k is the desired number of closed sequential patterns to be mined and min_? is the minimal length of each pattern. We mine the set of closed patterns because it is a compact representation of the complete set of frequent patterns. An efficient algorithm, called TSP, is developed for mining such patterns without min_support. Starting at (absolute) min_support=1, the algorithm makes use of the length constraint and the properties of top-k closed sequential patterns to perform dynamic support raising and projected database pruning. Our extensive performance study shows that TSP has high performance. In most cases, it outperforms the efficient closed sequential pattern-mining algorithm, CloSpan, even when the latter is running with the best tuned min_support threshold. Thus, we conclude that, for sequential pattern mining, mining top-k frequent closed sequential patterns without min_support is more preferable than the traditional min_support-based mining."
