id,author,year,text
92,1,2000,"Time-series data mining presents many challenges due to the intrinsic large scale and high dimensionality of the data sets. Subsequence similarity matching has been an active research area driven by the need to analyze large data sets in the financial, biomedical and scientific databases. In this paper, we investigate an intelligent subsequence similarity matching of time series queries based on efficient graph traversal. We introduce a new problem, the approximate partial matching of a query sequence in a time series database. Our system can address such queries with high specificity and minimal time and space overhead. The performance bottleneck of the current methods were analyzed and we show our method can improve the performance of the time series queries significantly. It is general and flexible enough to find the best approximate match query without specifying a tolerance ? parameter."
93,1,2000,"Data mining has become an important technique which has tremendous potential in many commercial and industrial applications. Attribute-oriented induction is a powerful mining technique and has been successfully implemented in the data mining system DBMiner (Han et al. Proc. 1996 Int'l Conf. on Data Mining and Knowledge Discovery (KDD'96), Portland, Oregon, 1996). However, its induction capability is limited by the unconditional concept generalization. In this paper, we extend the concept generalization to rule-based concept hierarchy, which enhances greatly its induction power. When previously proposed induction algorithm is applied to the more general rule-based case, a problem of induction anomaly occurs which impacts its efficiency. We have developed an efficient algorithm to facilitate induction on the rule-based case which can avoid the anomaly. Performance studies have shown that the algorithm is superior than a previously proposed algorithm based on backtracking."
94,1,2000,"Capturing application semantics and allowing a human analyst to express his focus in mining have been the motivation for several recent studies on constrained mining. In this paper, we introduce and study the problem of constrained clustering—finding clusters that satisfy certain user-specified constraints. We argue that this problem arises naturally in practice. Two types of constraints are discussed in this paper. The first type of constraints are imposed by physical obstacles that exist in the region of clustering. The second type of constraints are SQL constraints which every cluster must satisfy. We provide a preliminary introduction to both types of constraints and discuss some techniques for solving them."
95,1,2000,"Mining frequent patterns in transaction databases, time-series databases, and many other kinds of databases has been studied popularly in data mining research. Most of the previous studies adopt an Apriori-like candidate set generation-and-test approach. However, candidate set generation is still costly, especially when there exist prolific patterns and/or long patterns."
96,1,2000,"With the explosive growth of data available on the World Wide Web, discovery and analysis of useful information from the World Wide Web becomes a practical necessity. Web access pattern, which is the sequence of accesses pursued by users frequently, is a kind of interesting and useful knowledge in practice."
97,1,2000,"Clustering analysis has been a very active area of research in the data mining community. However, most algorithms have ignored the fact that physical obstacles exist in the real world and could thus affect the result of clustering dramatically. In this paper, we will look at the problem of clustering in the presence of obstacles. We called this problem the COE (Clustering with Obstacles Entities) problem and provide an outline of an algorithm called COE-CLARANS to solve it."
98,1,2000,"On 18-20 March 1999, a Specialist Meeting on \""Discovering geographic knowledge in data-rich environments\"" was convened under the auspices of the Varenius Project of the National Center for Geographic Information and Analysis (NCGIA). This, workshop brought together a diverse group of researchers and practitioners with interests in developing and applying new techniques for exploring large and diverse geographic datasets. The interaction prior to, during and after the three-day workshop resulted in the identification of research priorities and directions for continued development of \""geographic knowledge discovery\"" (GKD) theory techniques."
99,1,1999,"Multi-dimensional, inter-transaction association rules extend the traditional association rules to describe more general associations among items with multiple properties cross transactions. “After McDonald and Burger King open branches, KFC will open a branch two months later and one mile away” is an example of such rules. Since the number of potential inter-transaction association rules tends to be extremely large, mining inter-transaction associations poses more challenges on efficient processing than mining intra-transaction associations. In order to make such association mining truly practical and computationally tractable, in this study, we present a template model to help users declare the interesting inter-transaction associations to be mined. With the guidance of templates, several optimization techniques are devised to speed up the discovery of inter-transaction association rules. We show, through a series of experiments, that these optimization techniques can yield significant performance benefits."
100,1,1999,"A top-down progressive deepening method is developed for efficient mining of multiple-level association rules from large transaction databases based on the Apriori principle. A group of variant algorithms is proposed based on the ways of sharing intermediate results, with the relative performance tested and analyzed. The enforcement of different interestingness measurements to find more interesting rules, and the relaxation of rule conditions for finding level-crossing association rules, are also investigated in the paper. Our study shows that efficient algorithms can be developed from large databases for the discovery of interesting and strong multiple-level association rules."
101,1,1999,"Although many data-mining methodologies and systems have been developed in recent years, the authors contend that by and large, present mining models lack human involvement, particularly in the form of guidance and user control. They believe that data mining is most effective when the computer does what it does best like searching large databases or counting and users do what they do best, like specifying the current mining session's focus. This division of labor is best achieved through constraint-based mining, in which the user provides restraints that guide a search. Mining can also be improved by employing a multidimensional, hierarchical view of the data. Current data warehouse systems have provided a fertile ground for systematic development of this multidimensional mining. Together, constraint-based and multidimensional techniques can provide a more ad hoc, query-driven process that effectively exploits the semantics of data than those supported by current stand-alone data-mining systems."
102,1,1999,"The polygon amalgamation operation computes the boundary of the union of a set of polygons. This is an important operation for spatial on-line analytical processing and spatial data mining, where polygons representing different spatial objects often need to be amalgamated by varying criteria when the user wants to aggregate or reclassify these objects. The processing cost of this operation can be very high for a large number of polygons. Based on the observation that not all polygons to be amalgamated contribute to the boundary, we investigate in this paper efficient polygon amalgamation methods by excluding those internal polygons without retrieving them from the database. Two novel algorithms, adjacency-based and occupancy-based, are proposed. While both algorithms can reduce the amalgamation cost significantly, the occupancy-based algorithm is particularly attractive because: 1) it retrieves a smaller amount of data than the adjacency-based algorithm; 2) it is based on a simple extension to a commonly used spatial indexing mechanism; and 3) it can handle fuzzy amalgamation."
103,1,1999,"Although there have been many studies on data mining, to date there have been few research prototypes or commercial systems supporting comprehensive query-driven mining, which encourages interactive exploration of the data. Our thesis is that constraint constructs and the optimization they induce play a pivotal role in mining queries, thus substantially enhancing the usefulness and performance of the mining system. This is based on the analogy of declarative query languages like SQL and query optimization which have made relational databases so successful. To this end, our proposed demo is not yet another data mining system, but of a new paradigm in data mining mining with constraints, as the important first step towards supporting ad-hoc mining in DBMS."
104,1,1999,"Currently, there is tremendous interest in providing ad-hoc mining capabilities in database management systems. As a first step towards this goal, in [15] we proposed an architecture for supporting constraint-based, human-centered, exploratory mining of various kinds of rules including associations, introduced the notion of constrained frequent set queries (CFQs), and developed effective pruning optimizations for CFQs with 1-variable (1-var) constraints."
105,1,1999,"A novel indexing structure join index hierarchy is proposed to handle the \""gotos on disk\"" problem in object-oriented query processing. The method constructs a hierarchy of join indices and transforms a sequence of pointer chasing operations into a simple search in an appropriate join index file, and thus accelerates navigation in object-oriented databases. The method extends the join index structure studied in relational and spatial databases, supports both forward and backward navigations among objects and classes, and localizes update propagations in the hierarchy. Our performance study shows that partial join index hierarchy outperforms several other indexing mechanisms in object-oriented query processing."
106,1,1998,"Data Mining is a young but flourishing field. Many algorithms and applications exist to mine different types of data and extract different types of knowledge. Mining multimedia data is, however, at an experimental stage. We have implemented a prototype for mining high-level multimedia information and knowledge from large multimedia databases. MultiMedia Miner has been designed based on our years of experience in the research and development of a relational data mining system, DBMiner, in the Intelligent Database Systems Research Laboratory, and a Content-Based Image Retrieval system from Digital Libraries, C-BIRD, in the Vision and Media Laboratory. MultiMediaMiner includes the construction of multimedia data cubes which facilitate multiple dimensional analysis of multimedia data, and the mining of multiple kinds of knowledge, including summarization, classification, and association, in image and video databases. The images and video clips used in our experiments are collected by crawling the WWW. Many challenges have yet to be overcome, such as the large number of dimensions, and the existence of multi-valued dimensions."
107,1,1998,"Periodicity search, that is, search for cyclicity in time-related databases, is an interesting data mining problem. Most previous studies have been on finding full-cycle periodicity for all the segments in the selected sequences of the data, that is, if a sequence is periodic, all the points or segments in the period repeat. However, it is often useful to mine segment-wise or point-wise periodicity in time-related data sets. In this study, we integrate data cube and Apriori data mining techniques for mining segment-wise periodicity in regard to a fixed length period and show that data cube provides an efficient structure and a convenient way for interactive mining of multiple-level periodicity."
108,1,1998,"From the standpoint of supporting human-centered discovery of knowledge, the present-day model of mining association rules suffers from the following serious shortcomings: (i) lack of user exploration and control, (ii) lack of focus, and (iii) rigid notion of relationships. In effect, this model functions as a black-box, admitting little user interaction in between. We propose, in this paper, an architecture that opens up the black-box, and supports constraint-based, human-centered exploratory mining of associations. The foundation of this architecture is a rich set of constraint constructs, including domain, class, and SQL-style aggregate constraints, which enable users to clearly specify what associations are to be mined. We propose constrained association queries as a means of specifying the constraints to be satisfied by the antecedent and consequent of a mined association."
109,1,1998,"Multimedia data mining is the mining of high-level multimedia information and knowledge from large multimedia databases. A multimedia data mining system prototype, MultiMediaMiner, has been designed and developed. It includes the construction of a multimedia data cube which facilitates multiple dimensional analysis of multimedia data, primarily based on visual content, and the mining of multiple kinds of knowledge, including summarization, comparison, classification, association, and clustering."
110,1,1998,"As a confluence of data mining and WWW technologies, it is now possible to perform data mining on web log records collected from the Internet web page access history. The behavior of the web page readers is imprinted in the web server log files. Analyzing and exploring regularities in this behavior can improve system performance, enhance the quality and delivery of Internet information services to the end user, and identify population of potential customers for electronic commerce. Thus, by observing people using collections of data, data mining can bring considerable contribution to digital library designers. In a joint effort between the TeleLearning-NCE project on Virtual University and NCE-IRIS project on data mining, we have been developing the knowledge discovery tool, WebLogMiner, for mining web server log files. This paper presents the design of the WebLogMiner, reports the current progress, and outlines the future work in this direction."
111,1,1998,"Great efforts have been paid in the Intelligent Database Systems Research Lab for the research and development of efficient data mining methods and construction of on-line analytical data mining systems. Our work has been focused on the integration of data mining and OLAP technologies and the development of scalable, integrated, and multiple data mining functions. A data mining system, DBMiner, has been developed for interactive mining of multiple-level knowledge in large relational databases and data warehouses. The system implements a wide spectrum of data mining functions, including characterization, comparison, association, classification, prediction, and clustering. It also builds up a user-friendly, interactive data mining environment and a set of knowledge visualization tools. In-depth research has been performed on the efficiency and scalability of data mining methods. Moreover, the research has been extended to spatial data mining, multimedia data mining, text mining, and Web mining with several new data mining system prototypes constructed or under construction, including GeoMiner, MultiMediaMiner, and WebLogMiner. This article summarizes our research and development activities in the last several years and shares our experiences and lessons with the readers."
112,1,1997,"A data mining system, DBMiner, has been developed for interactive mining of multiple-level knowledge in large relational databases and data warehouses. The system implements a wide spectrum of data mining functions, including characterization, comparison, association, classification, prediction, and clustering. By incorporating several interesting data mining techniques, including OLAP and attribute-oriented induction, statistical analysis, progressive deepening for mining multiple-level knowledge, and meta-rule guided mining, the system provides a user-friendly, interactive data mining environment with good performance."
113,1,1997,"In this paper, we employ a novel approach to metarule-guided, multi-dimensional association rule mining which explores a data cube structure. We propose algorithms for metarule-guided mining: given a metarule containing p predicates, we compare mining on an n-dimensional (n-D) cube structure (where p < n) with mining on smaller multiple p-dimensional cubes. In addition, we propose an efficient method for precomputing the cube, which takes into account the constraints imposed by the given metarule."
114,1,1997,"Efficiency and scalability are fundamental issues concerning data mining in large databases. Although classification has been studied extensively, few of the known methods take serious consideration of efficient induction in large databases and the analysis of data at multiple abstraction levels. The paper addresses the efficiency and scalability issues by proposing a data classification method which integrates attribute oriented induction, relevance analysis, and the induction of decision trees. Such an integration leads to efficient, high quality, multiple level classification of large amounts of data, the relaxation of the requirement of perfect training sets, and the elegant handling of continuous and noisy data."
115,1,1996,"With the existence of many large transaction databases, the huge   amounts of data, the high scalability of distributed systems, and the easy partition and distribution of a centralized database, it is important to investigate efficient methods for distributed mining of association rules. This study discloses some interesting relationships between locally large and globally large itemsets and proposes an interesting distributed association rule mining algorithm, FDM (Fast Distributed Mining of association rules), which generates a small number of candidate sets and substantially reduces the number of messages to be passed at mining association rules. Our performance study shows that FDM has a superior performance over the direct application of a typical sequential algorithm. Further  performance enhancement leads to a few variations of the algorithm."
116,1,1996,"Mining information and knowledge from large databases has been recognized by many researchers as a key research topic in database systems and machine learning, and by many industrial companies as an important area with an opportunity of major revenues. Researchers in many different fields have shown great interest in data mining. Several emerging applications in information providing services, such as data warehousing and on-line services over the Internet, also call for various data mining techniques to better understand user behavior, to improve the service provided, and to increase the business opportunities. In response to such a demand, this article is to provide a survey, from a database researcher's point of view, on the data mining techniques developed recently. A classification of the available data mining techniques is provided, and a comparative study of such techniques is presented."
117,1,1996,"In object-oriented database systems where the concept of the superclass-subclass is supported, an instance of a subclass is also an instance of its superclass. Consequently, the access scope of a query against a class in general includes the access scope of all its subclasses, unless specified otherwise. An index to support superclass-subclass relationship efficiently must provide efficient associative retrievals of objects from a single class or from several classes in a class hierarchy. This paper presents an efficient index called the hierarchical tree (the H-tree). For each class, an H-tree is maintained, allowing efficient search on a single class. These H-trees are appropriately linked to capture the superclass-subclass relationships, thus allowing efficient retrievals of instances from a class hierarchy. Both experimental and analytical results indicate that the H-tree is an efficient indexing structure."
118,1,1996,"A data mining system, DBMiner, has been developed for interactive mining of multiple-level knowledge in large relational databases. The system implements a wide spectrum of data mining functions, including generalization, characterization, association, classification, and prediction. By incorporating several interesting data mining techniques, including attribute-oriented induction, statistical analysis, progressive deepening for mining multiple-level knowledge, and meta-rule guided mining, the system provides a user-friendly, interactive data mining environment with good performance."
119,1,1996,"Knowledge discovery facilitates querying database knowledge and intelligent query answering in database systems. In this paper, we investigate the application of discovered knowledge, concept hierarchies, and knowledge discovery tools for intelligent query answering in database systems. A knowledge-rich data model is constructed to incorporate discovered knowledge and knowledge discovery tools. Queries are classified into data queries and knowledge queries. Both types of queries can be answered directly by simple retrieval or intelligently by analyzing the intent of query and providing generalized, neighborhood or associated information using stored or discovered knowledge. Techniques have been developed for intelligent query answering using discovered knowledge and/or knowledge discovery tools, which includes generalization, data summarization, concept clustering, rule discovery, query rewriting, deduction, lazy evaluation, application of multiple-layered databases, etc. Our study shows that knowledge discovery substantially broadens the spectrum of intelligent query answering and may have deep implications on query answering in data- and knowledge-base systems."
120,1,1996,"Data mining, or knowledge discovery in databases, has been popularly recognized as an important research issue with broad applications. We provide a comprehensive survey, in database perspective, on the data mining techniques developed recently. Several major kinds of data mining methods, including generalization, characterization, classification, clustering, association, evolution, pattern matching, data visualization, and meta-rule guided mining, will be reviewed. Techniques for mining knowledge in different kinds of databases, including relational, transaction, object-oriented, spatial, and active databases, as well as global information systems, will be examined. Potential data mining applications and some research issues will also be discussed."
121,1,1996,"An incremental updating technique is developed for maintenance of the association rules discovered by database mining. There have been many studies on efficient discovery of association rules in large databases. However, it is nontrivial to maintain such discovered rules in large databases because a database may allow frequent or occasional updates and such updates may not only invalidate some existing strong association rules but also turn some weak rules into strong ones. In this study, an incremental updating technique is proposed for efficient maintenance of discovered association rules when new transaction data are added to a transaction database."
122,1,1995,"Efficient and effective discovery of resource and knowledge from the Internet has become an imminent research issue, especially with the advent of the Information Super-Highway. A multiple layered database (MLDB) approach is proposed to handle the resource and knowledge discovery in global information base. A preliminary experiment shows the advantages of such an approach. Information retrieval, data mining, and data analysis techniques can be used to extract and transform information from a lower layer database to a higher one. Resources can be found by controlled search through different layers of the database, and knowledge discovery can be performed efficiently in such a layered database."
123,1,1995,"A prototyped data mining system, DBLearn, was developed in Simon Fraser Univ., which integrates machine learning methodologies with database technologies and efficiently and effectively extracts characteristic and discriminant rules from relational databases. Further developments, of DBLearn lead to a new generation data mining system: DBMiner, with the following features: (1) mining new kinds of rules from large databases, including multiple-level association rules, classification rules, cluster description rules, etc., (2) automatic generation and refinement of concept hierarchies, (3) high level SQL-like and graphical data mining interfaces, and (4) client/server architecture and performance improvements for large applications. The major features of the system are demonstrated with experiments in a research grant information database."
